Cites,Authors,Title,Year,Source,Publisher,ArticleURL,CitesURL,GSRank,QueryDate,Type,DOI,ISSN,CitationURL,Volume,Issue,StartPage,EndPage,ECC,CitesPerYear,CitesPerAuthor,AuthorCount,Age,Abstract,FullTextURL,RelatedURL
19,"A Yeboah-Ofori, A Jafar, T Abisogun…","Data security and governance in multi-cloud computing environment",2024,"… on Future Internet of …","ieeexplore.ieee.org","https://ieeexplore.ieee.org/abstract/document/10743006/","https://scholar.google.com/scholar?cites=13739533269160506222&as_sdt=2005&sciodt=2007&hl=en",1,"2026-05-16 00:45:12","","","",,,,,,19,9.50,5,4,2,"… These challenges have led to various types of attacks, such as supply chain attacks, data … managing multi-cloud Kubernetes workloads of the AWS EKS Anywhere interface. [35]. …","https://repository.uwl.ac.uk/id/eprint/12332/1/Data%20Security%20and%20Governance%20in%20Multi-Cloud%20Computing%20Environment%20-%20Rep.pdf","https://scholar.google.com/scholar?q=related:bjP5j7agrL4J:scholar.google.com/&scioq=%22software+supply+chain+security%22%7C%22supply+chain+attacks%22+%22multi+cloud+kubernetes%22&hl=en&as_sdt=2007&as_ylo=2020&as_yhi=2025"
4,"K Thirumalaisamy","Cloud-Native Defense-in-Depth Security for Mission-Critical Services in Managed Kubernetes",,"Volume","researchgate.net","https://www.researchgate.net/profile/Karthikeyan-Thirumalaisamy/publication/394541193_Cloud-Native_Defense-in-Depth_Security_for_Mission-Critical_Services_in_Managed_Kubernetes/links/68a3f5d67984e374ace98fd5/Cloud-Native-Defense-in-Depth-Security-for-Mission-Critical-Services-in-Managed-Kubernetes.pdf","https://scholar.google.com/scholar?cites=3124142509366129668&as_sdt=2005&sciodt=2007&hl=en",2,"2026-05-16 00:45:12","PDF","","",,,,,,4,0.00,4,1,,"… against insider threats and software supply chain attacks and escape runtime exploits through … to limit risk as part of the overall risk management strategy in multi-cloud Kubernetes. …","https://www.researchgate.net/profile/Karthikeyan-Thirumalaisamy/publication/394541193_Cloud-Native_Defense-in-Depth_Security_for_Mission-Critical_Services_in_Managed_Kubernetes/links/68a3f5d67984e374ace98fd5/Cloud-Native-Defense-in-Depth-Security-for-Mission-Critical-Services-in-Managed-Kubernetes.pdf","https://scholar.google.com/scholar?q=related:BDR3Ug8vWysJ:scholar.google.com/&scioq=%22software+supply+chain+security%22%7C%22supply+chain+attacks%22+%22multi+cloud+kubernetes%22&hl=en&as_sdt=2007&as_ylo=2020&as_yhi=2025"
3,"S Gajula","A decade of cloud-native technologies: Multi-cloud strategies, docker, and ci/cd pipelines",2025,"International Journal of Advanced Computer Science …","researchgate.net","https://www.researchgate.net/profile/Sreenivasulu-Gajula-2/publication/394361057_A_Decade_of_Cloud-Native_TechnologiesMulti-_Cloud_Strategies_Docker_and_CICD_Pipelines/links/6893fd3e37ccad613803c30d/A-Decade-of-Cloud-Native-TechnologiesMulti-Cloud-Strategies-Docker-and-CI-CD-Pipelines.pdf","https://scholar.google.com/scholar?cites=7108870193586163094&as_sdt=2005&sciodt=2007&hl=en",3,"2026-05-16 00:45:12","PDF","","",,,,,,3,3.00,3,1,1,"… Software supply chain attacks, like the injection of malicious code into automated builds, become increasingly frequent, making the urgency to adopt secure DevOps practices and …","https://www.researchgate.net/profile/Sreenivasulu-Gajula-2/publication/394361057_A_Decade_of_Cloud-Native_TechnologiesMulti-_Cloud_Strategies_Docker_and_CICD_Pipelines/links/6893fd3e37ccad613803c30d/A-Decade-of-Cloud-Native-TechnologiesMulti-Cloud-Strategies-Docker-and-CI-CD-Pipelines.pdf","https://scholar.google.com/scholar?q=related:ls0Q08bHp2IJ:scholar.google.com/&scioq=%22software+supply+chain+security%22%7C%22supply+chain+attacks%22+%22multi+cloud+kubernetes%22&hl=en&as_sdt=2007&as_ylo=2020&as_yhi=2025"
0,"RK Kripa","KubeSecOps: Continuous Security Assurance in Kubernetes-Based DevSecOps Pipelines for AI Workloads",2025,"2025 IEEE International Conference on Advances in …","ieeexplore.ieee.org","https://ieeexplore.ieee.org/abstract/document/11436334/","",4,"2026-05-16 00:45:12","","","",,,,,,0,0.00,0,1,1,"… AI models deployed in Kubernetes are susceptible to a wide range of supply chain attacks, … modern CI/CD workflows, multi-cloud Kubernetes deployments, and AI pipeline orchestration …","","https://scholar.google.com/scholar?q=related:644xzvMM2dAJ:scholar.google.com/&scioq=%22software+supply+chain+security%22%7C%22supply+chain+attacks%22+%22multi+cloud+kubernetes%22&hl=en&as_sdt=2007&as_ylo=2020&as_yhi=2025"
10,"Z Morić, V Dakić, T Čavala","Security hardening and compliance assessment of Kubernetes control plane and workloads",2025,"Journal of cybersecurity and privacy","mdpi.com","https://www.mdpi.com/2624-800X/5/2/30","https://scholar.google.com/scholar?cites=7715829182677993044&as_sdt=2005&sciodt=2007&hl=en",5,"2026-05-16 00:45:12","HTML","","",,,,,,10,10.00,3,3,1,"… A comprehensive Zero Trust framework could significantly mitigate lateral movement within clusters and fortify the environment against insider threats and supply chain attacks. …","https://www.mdpi.com/2624-800X/5/2/30","https://scholar.google.com/scholar?q=related:VEYd7cIhFGsJ:scholar.google.com/&scioq=%22software+supply+chain+security%22%7C%22supply+chain+attacks%22+%22multi+cloud+kubernetes%22&hl=en&as_sdt=2007&as_ylo=2020&as_yhi=2025"
1,"S Panchumarthi","A National Cyber Defense Framework: Architecting Federated, AI-Powered, Zero-Trust Security at Scale",2025,"","techrxiv.org","https://www.techrxiv.org/doi/abs/10.36227/techrxiv.175321961.11008476","https://scholar.google.com/scholar?cites=1389379282676424539&as_sdt=2005&sciodt=2007&hl=en",6,"2026-05-16 00:45:12","","10.36227/techrxiv.175321961.11008476","",,,,,,1,1.00,1,1,1,"… The rapid exploitation of unknown vulnerabilities, known as zero-day exploits, alongside sophisticated supply-chain attacks, remain formidable challenges. Threat actors increasingly …","https://www.techrxiv.org/doi/pdf/10.36227/techrxiv.175321961.11008476","https://scholar.google.com/scholar?q=related:Wx83qhgRSBMJ:scholar.google.com/&scioq=%22software+supply+chain+security%22%7C%22supply+chain+attacks%22+%22multi+cloud+kubernetes%22&hl=en&as_sdt=2007&as_ylo=2020&as_yhi=2025"
22,"S Kamadi","Identity-Driven Zero Trust Automation in GitOps: Policy-as-Code Enforcement for Secure Code Deployments",2023,"International Journal of Scientific Research in …","researchgate.net","https://www.researchgate.net/profile/Sandeep-Kamadi/publication/398925800_Identity-Driven_Zero_Trust_Automation_in_GitOps_Policy-as-Code_Enforcement_for_Secure_code_Deployments/links/6948e21806a9ab54f848ff62/Identity-Driven-Zero-Trust-Automation-in-GitOps-Policy-as-Code-Enforcement-for-Secure-code-Deployments.pdf","https://scholar.google.com/scholar?cites=2689197609540417864&as_sdt=2005&sciodt=2007&hl=en",7,"2026-05-16 00:45:12","PDF","","",,,,,,22,7.33,22,1,3,"This research presents an identity-driven Zero Trust architecture for GitOpsmanaged Kubernetes environments, integrating continuous authentication, least-privilege authorization, and …","https://www.researchgate.net/profile/Sandeep-Kamadi/publication/398925800_Identity-Driven_Zero_Trust_Automation_in_GitOps_Policy-as-Code_Enforcement_for_Secure_code_Deployments/links/6948e21806a9ab54f848ff62/Identity-Driven-Zero-Trust-Automation-in-GitOps-Policy-as-Code-Enforcement-for-Secure-code-Deployments.pdf","https://scholar.google.com/scholar?q=related:SHl8V_ryUSUJ:scholar.google.com/&scioq=%22software+supply+chain+security%22%7C%22supply+chain+attacks%22+%22multi+cloud+kubernetes%22&hl=en&as_sdt=2007&as_ylo=2020&as_yhi=2025"
0,"W Smith","Mizar Networks for Kubernetes: The Complete Guide for Developers and Engineers",2025,"","books.google.com","https://books.google.com/books?hl=en&lr=&id=z9yKEQAAQBAJ&oi=fnd&pg=PT9&dq=%22software+supply+chain+security%22%7C%22supply+chain+attacks%22+%22multi+cloud+kubernetes%22&ots=tdiIv5isSY&sig=MxjWL0bdgjszdZGWVjgrSTKV1VQ","",8,"2026-05-16 00:45:12","BOOK","","",,,,,,0,0.00,0,1,1,"… With the rise of hybrid and multi-cloud Kubernetes deployments, CNIs face the arduous task of maintaining consistent and performant networking across diverse infrastructures. Existing …","","https://scholar.google.com/scholar?q=related:Q-SNFMwXLaoJ:scholar.google.com/&scioq=%22software+supply+chain+security%22%7C%22supply+chain+attacks%22+%22multi+cloud+kubernetes%22&hl=en&as_sdt=2007&as_ylo=2020&as_yhi=2025"
0,"R Pandipati","Secure Code Deployments with Policy-as-Code Enforcement in Identity-Driven Zero Trust Automation in GitOps",2024,"","academia.edu","https://www.academia.edu/download/125374341/WJARR_2024_0790.pdf","",9,"2026-05-16 00:45:12","PDF","","",,,,,,0,0.00,0,1,2,"This research presents an identity-driven Zero Trust architecture for GitOps-managed Kubernetes environments, integrating continuous authentication, least-privilege authorization, and …","https://www.academia.edu/download/125374341/WJARR_2024_0790.pdf","https://scholar.google.com/scholar?q=related:x-YJUSlDxF8J:scholar.google.com/&scioq=%22software+supply+chain+security%22%7C%22supply+chain+attacks%22+%22multi+cloud+kubernetes%22&hl=en&as_sdt=2007&as_ylo=2020&as_yhi=2025"
