Cites,Authors,Title,Year,Source,Publisher,ArticleURL,CitesURL,GSRank,QueryDate,Type,DOI,ISSN,CitationURL,Volume,Issue,StartPage,EndPage,ECC,CitesPerYear,CitesPerAuthor,AuthorCount,Age,Abstract,FullTextURL,RelatedURL
0,"J Bufalino, M Di Francesco, A Blaise…","SBOMproof: Beyond Alleged SBOM Compliance for Supply Chain Security of Container Images",2025,"arXiv preprint arXiv …","arxiv.org","https://arxiv.org/abs/2510.05798","",1,"2026-05-16 00:44:33","","","",,,,,,0,0.00,0,4,1,"… Our study also uncovered a novel vulnerability, the SBOM confusion, where incompatibilities in the SBOM prevent reliable vulnerability detection across tools. We finally implement a …","https://arxiv.org/pdf/2510.05798","https://scholar.google.com/scholar?q=related:ZNrZHcxmyM8J:scholar.google.com/&scioq=%22kubernetes+security%22%7C%22kubernetes+admission+control%22+%22sbom%22%7C%22cyclonedx%22%7C%22spdx%22&hl=en&as_sdt=2007&as_ylo=2020&as_yhi=2025"
41,"S Anasuri","Secure Software Supply Chains in Open-Source Ecosystems",2023,"International Journal of Emerging Trends in Computer …","ijetcsit.org","https://www.ijetcsit.org/index.php/ijetcsit/article/view/351","https://scholar.google.com/scholar?cites=564915148610762141&as_sdt=2005&sciodt=2007&hl=en",2,"2026-05-16 00:44:33","","","",,,,,,41,13.67,41,1,3,"… the Nation's Cybersecurity requires the use of SBOM and secures development guidelines in … These statistics indicate the increasing awareness that Kubernetes security is no longer all …","https://www.ijetcsit.org/index.php/ijetcsit/article/download/351/302","https://scholar.google.com/scholar?q=related:nXUuqVX71gcJ:scholar.google.com/&scioq=%22kubernetes+security%22%7C%22kubernetes+admission+control%22+%22sbom%22%7C%22cyclonedx%22%7C%22spdx%22&hl=en&as_sdt=2007&as_ylo=2020&as_yhi=2025"
0,"C Moschos","Securing supply chain components: an offensive approach on containerization technology",2025,"","dione.lib.unipi.gr","https://dione.lib.unipi.gr/xmlui/handle/unipi/18308","",3,"2026-05-16 00:44:33","","","",,,,,,0,0.00,0,1,1,"… In effect, supply chain security becomes an inseparable part of Kubernetes security, because any compromise upstream can cascade downstream and undermine the entire system’s …","https://dione.lib.unipi.gr/xmlui/bitstream/handle/unipi/18308/thesis_p16188_cmoschos_2025-final.pdf?sequence=1","https://scholar.google.com/scholar?q=related:awJniiLub2QJ:scholar.google.com/&scioq=%22kubernetes+security%22%7C%22kubernetes+admission+control%22+%22sbom%22%7C%22cyclonedx%22%7C%22spdx%22&hl=en&as_sdt=2007&as_ylo=2020&as_yhi=2025"
1,"F Siavashi","A Pipeline Architecture for Container Security",2024,"","theseus.fi","https://www.theseus.fi/handle/10024/859537","https://scholar.google.com/scholar?cites=340799746112233769&as_sdt=2005&sciodt=2007&hl=en",4,"2026-05-16 00:44:33","","","",,,,,,1,0.50,1,1,2,"… The result of such analysis is often provided as a (SBOM) (29). This stage also contributes … Software Bill of Materials (SBOM): An Overview. Systems Modeling: Methodologies and Tools. …","https://www.theseus.fi/bitstream/handle/10024/859537/Siavashi_Ferdos.pdf?sequence=2","https://scholar.google.com/scholar?q=related:KSGQPpDDugQJ:scholar.google.com/&scioq=%22kubernetes+security%22%7C%22kubernetes+admission+control%22+%22sbom%22%7C%22cyclonedx%22%7C%22spdx%22&hl=en&as_sdt=2007&as_ylo=2020&as_yhi=2025"
0,"J Heo","A Multi-Layered Security Assessment Framework for Kubernetes: Enhancing Cloud Security Assurance Program Criteria in Korea",2025,"INTERNATIONAL CONFERENCE ON FUTURE …","dbpia.co.kr","https://www.dbpia.co.kr/Journal/articleDetail?nodeId=NODE12293111","",5,"2026-05-16 00:44:33","CITATION","","",,,,,,0,0.00,0,1,1,"… This paper is a preliminary study analyzing CSAP Kubernetes security limitations and proposing … DevSecOps-based Kubernetes security automation framework. Key directions include: …","","https://scholar.google.com/scholar?q=related:v71X9MQ8F8YJ:scholar.google.com/&scioq=%22kubernetes+security%22%7C%22kubernetes+admission+control%22+%22sbom%22%7C%22cyclonedx%22%7C%22spdx%22&hl=en&as_sdt=2007&as_ylo=2020&as_yhi=2025"
0,"A Aquino","A Combined Approach to Kubernetes Security with Trivy and Falco",2025,"","theseus.fi","https://www.theseus.fi/handle/10024/891495","",6,"2026-05-16 00:44:33","","","",,,,,,0,0.00,0,1,1,"… This study demonstrated that the combination of Trivy and Falco enhances Kubernetes security by providing a more comprehensive approach, covering different stages of the …","https://www.theseus.fi/bitstream/handle/10024/891495/Aquino_Alyssa.pdf?sequence=2","https://scholar.google.com/scholar?q=related:28ear-ngEz0J:scholar.google.com/&scioq=%22kubernetes+security%22%7C%22kubernetes+admission+control%22+%22sbom%22%7C%22cyclonedx%22%7C%22spdx%22&hl=en&as_sdt=2007&as_ylo=2020&as_yhi=2025"
3,"J Girhotra, A Byrisetty","Securing cloud-native applications (CNAs): A case study of practices in a large IT company",2025,"","diva-portal.org","https://www.diva-portal.org/smash/record.jsf?pid=diva2:1980200","https://scholar.google.com/scholar?cites=6463324854113100975&as_sdt=2005&sciodt=2007&hl=en",7,"2026-05-16 00:44:33","","","",,,,,,3,3.00,2,2,1,"… As we read through a document (eg, a Kubernetes security guideline or a CI/CD security checklist), we took notes and highlighted sections pertaining to CNA security. We also recorded …","https://www.diva-portal.org/smash/get/diva2:1980200/FULLTEXT01.pdf","https://scholar.google.com/scholar?q=related:r2Rd7bVXslkJ:scholar.google.com/&scioq=%22kubernetes+security%22%7C%22kubernetes+admission+control%22+%22sbom%22%7C%22cyclonedx%22%7C%22spdx%22&hl=en&as_sdt=2007&as_ylo=2020&as_yhi=2025"
0,"A Ganesh","Securing Infrastructure as Code deployments with Bills of Materials Approaches",2023,"","","","",8,"2026-05-16 00:44:33","CITATION","","",,,,,,0,0.00,0,1,3,"","","https://scholar.google.com/scholar?q=related:HcccKx8uhYAJ:scholar.google.com/&scioq=%22kubernetes+security%22%7C%22kubernetes+admission+control%22+%22sbom%22%7C%22cyclonedx%22%7C%22spdx%22&hl=en&as_sdt=2007&as_ylo=2020&as_yhi=2025"
0,"K Slimani, V Aseri, A Gupta…","Security Testing: Cyber Incident and Vulnerability, Mitigations and Forensics",2025,"Cyber Security, Forensics …","api.taylorfrancis.com","https://api.taylorfrancis.com/content/chapters/edit/download?identifierName=doi&identifierValue=10.1201/9781003497868-15&type=chapterpdf","",9,"2026-05-16 00:44:33","","","",,,,,,0,0.00,0,4,1,"… Automated tools like Kubernetes security scanners are now increasingly being used to search for these kinds of misconfigurations and fix them. 5. Insecure Design: It’sa new class here …","","https://scholar.google.com/scholar?q=related:kDmf2QCmPqkJ:scholar.google.com/&scioq=%22kubernetes+security%22%7C%22kubernetes+admission+control%22+%22sbom%22%7C%22cyclonedx%22%7C%22spdx%22&hl=en&as_sdt=2007&as_ylo=2020&as_yhi=2025"
4,"A Chen, Z Guo, Z Jin, Z Li, Y Chen","Breaking the bulkhead: Demystifying cross-namespace reference vulnerabilities in kubernetes operators",2025,"arXiv preprint arXiv:2507.03387","arxiv.org","https://arxiv.org/abs/2507.03387","https://scholar.google.com/scholar?cites=12414809459705177982&as_sdt=2005&sciodt=2007&hl=en",10,"2026-05-16 00:44:33","","","",,,,,,4,4.00,1,5,1,"… Rahman, “Xi commandments of kubernetes security: A systematization of knowledge related to kubernetes security practices,” in 2020 IEEE Secure Development (SecDev), 2020, pp. 58…","https://arxiv.org/pdf/2507.03387","https://scholar.google.com/scholar?q=related:fufiV21DSqwJ:scholar.google.com/&scioq=%22kubernetes+security%22%7C%22kubernetes+admission+control%22+%22sbom%22%7C%22cyclonedx%22%7C%22spdx%22&hl=en&as_sdt=2007&as_ylo=2020&as_yhi=2025"
1,"O Pidlubnyi","Increasing Security and Reducing Risks Running Services in a Potential Containerized Environment While Meeting Regulatory Standards",2023,"","PhD thesis, Alpen-Adria-Universität …","","https://scholar.google.com/scholar?cites=4339681099008550187&as_sdt=2005&sciodt=2007&hl=en",11,"2026-05-16 00:44:33","CITATION","","",,,,,,1,0.33,1,1,3,"","","https://scholar.google.com/scholar?q=related:K6XhiPekOTwJ:scholar.google.com/&scioq=%22kubernetes+security%22%7C%22kubernetes+admission+control%22+%22sbom%22%7C%22cyclonedx%22%7C%22spdx%22&hl=en&as_sdt=2007&as_ylo=2020&as_yhi=2025"
0,"AJ Ocanto Caripa","Evaluación de buenas prácticas de seguridad en una plataforma serverless On-Premises",2025,"","","","",12,"2026-05-16 00:44:33","CITATION","","",,,,,,0,0.00,0,1,1,"","","https://scholar.google.com/scholar?q=related:w7ViUGWkskgJ:scholar.google.com/&scioq=%22kubernetes+security%22%7C%22kubernetes+admission+control%22+%22sbom%22%7C%22cyclonedx%22%7C%22spdx%22&hl=en&as_sdt=2007&as_ylo=2020&as_yhi=2025"
4,"A Mycek, M Lukaczyk","Security Of Containerization Platforms: Threat Modelling, Vulnerability Analysis, And Riskmitigation.",2024,"ECMS","scs-europe.net","https://www.scs-europe.net/dlib/2024/ecms2024acceptedpapers/0585_secmos_ecms2024_0071.pdf","https://scholar.google.com/scholar?cites=2936543713496002143&as_sdt=2005&sciodt=2007&hl=en",13,"2026-05-16 00:44:33","PDF","","",,,,,,4,2.00,2,2,2,"… Furthermore, the tool can identify known vulnerabilities (CVEs) and secrets and use software packages and dependencies (SBOM). Recently, the concept of DevSecOps has gained …","https://www.scs-europe.net/dlib/2024/ecms2024acceptedpapers/0585_secmos_ecms2024_0071.pdf","https://scholar.google.com/scholar?q=related:X-5V7vKywCgJ:scholar.google.com/&scioq=%22kubernetes+security%22%7C%22kubernetes+admission+control%22+%22sbom%22%7C%22cyclonedx%22%7C%22spdx%22&hl=en&as_sdt=2007&as_ylo=2020&as_yhi=2025"
33,"R Chandramouli","Implementation of devsecops for a microservices-based application with service mesh",2022,"NIST Special Publication","csrc.nist.rip","https://csrc.nist.rip/external/nvlpubs.nist.gov/nistpubs/SpecialPublications/NIST.SP.800-204C.pdf","https://scholar.google.com/scholar?cites=13647280992005085616&as_sdt=2005&sciodt=2007&hl=en",14,"2026-05-16 00:44:33","PDF","","",,,,,,33,8.25,33,1,4,"… • The Centers for Medicare and Medicaid Services (CMS) is adopting a DevSecOps approach where one emphasis is on laying the groundwork for the software bill of materials (SBOM) …","https://csrc.nist.rip/external/nvlpubs.nist.gov/nistpubs/SpecialPublications/NIST.SP.800-204C.pdf","https://scholar.google.com/scholar?q=related:sFlnfsHhZL0J:scholar.google.com/&scioq=%22kubernetes+security%22%7C%22kubernetes+admission+control%22+%22sbom%22%7C%22cyclonedx%22%7C%22spdx%22&hl=en&as_sdt=2007&as_ylo=2020&as_yhi=2025"
6,"G Thiyagarajan, P Nayak","Docker under siege: Securing containers in the modern era",2025,"arXiv preprint arXiv:2506.02043","arxiv.org","https://arxiv.org/abs/2506.02043","https://scholar.google.com/scholar?cites=8465806675507672092&as_sdt=2005&sciodt=2007&hl=en",15,"2026-05-16 00:44:33","","","",,,,,,6,6.00,3,2,1,"Containerization, driven by Docker, has transformed application development and deployment by enhancing efficiency and scalability. However, the rapid adoption of container …","https://arxiv.org/pdf/2506.02043","https://scholar.google.com/scholar?q=related:HPTDTlGWfHUJ:scholar.google.com/&scioq=%22kubernetes+security%22%7C%22kubernetes+admission+control%22+%22sbom%22%7C%22cyclonedx%22%7C%22spdx%22&hl=en&as_sdt=2007&as_ylo=2020&as_yhi=2025"
1,"A Wimbauer, L Muscariello, J Samain…","ThreatCompute: Leveraging LLMs for Automated Threat Modeling of Cloud-Native Applications",2025,"Proceedings of the …","dl.acm.org","https://dl.acm.org/doi/abs/10.1145/3733812.3765533","https://scholar.google.com/scholar?cites=8901321212400059544&as_sdt=2005&sciodt=2007&hl=en",16,"2026-05-16 00:44:33","","10.1145/3733812.3765533","",,,,,,1,1.00,0,4,1,"… Kubernetes security, threat modeling, and attack graphs, followed by a introduction to the MITRE ATT&CK framework. Kubernetes Security. … includes aggregating the SBOM and inferring …","https://dl.acm.org/doi/pdf/10.1145/3733812.3765533","https://scholar.google.com/scholar?q=related:mETBQHvYh3sJ:scholar.google.com/&scioq=%22kubernetes+security%22%7C%22kubernetes+admission+control%22+%22sbom%22%7C%22cyclonedx%22%7C%22spdx%22&hl=en&as_sdt=2007&as_ylo=2020&as_yhi=2025"
0,"I SYN, SU ESOFT","D4. 1 Integration guidelines &initial NEMO integration",,"meta-os.eu","","https://meta-os.eu/wp-content/uploads/2024/06/NEMO_D4.1_Integration-guidelines-initial-NEMO-integration_v1.0.pdf","",17,"2026-05-16 00:44:33","PDF","","",,,,,,0,0.00,0,2,,"NEMO aspires to meet the ambitious goal of developing a meta-Operating System (metaOS), which will democratize the usage of resources anywhere in the IoT, edge and cloud …","https://meta-os.eu/wp-content/uploads/2024/06/NEMO_D4.1_Integration-guidelines-initial-NEMO-integration_v1.0.pdf","https://scholar.google.com/scholar?q=related:gEDbEY36SPoJ:scholar.google.com/&scioq=%22kubernetes+security%22%7C%22kubernetes+admission+control%22+%22sbom%22%7C%22cyclonedx%22%7C%22spdx%22&hl=en&as_sdt=2007&as_ylo=2020&as_yhi=2025"
0,"RMM Mowla","Net-Zero self-adaptive activation of distributed self-resilient augmented services",,"natwork-project.eu","","https://natwork-project.eu/sites/default/files/2025-11/%5BNATWORK%5D%20D3.5%20Pre-Deployment%20Security%20per%20Construction%20Measures.r1%20(TSS).pdf","",18,"2026-05-16 00:44:33","PDF","","",,,,,,0,0.00,0,1,,"… We then turn to Kubernetes security analysis, since … xAPP SBOM management WG11 stresses that one noticeable element is that the requirement or recommendation for xAPP SBOM …","https://natwork-project.eu/sites/default/files/2025-11/%5BNATWORK%5D%20D3.5%20Pre-Deployment%20Security%20per%20Construction%20Measures.r1%20(TSS).pdf","https://scholar.google.com/scholar?q=related:SAy2CweKy60J:scholar.google.com/&scioq=%22kubernetes+security%22%7C%22kubernetes+admission+control%22+%22sbom%22%7C%22cyclonedx%22%7C%22spdx%22&hl=en&as_sdt=2007&as_ylo=2020&as_yhi=2025"
7,"P Saxena","Container image security with trivy and istio inter-service secure communication in kubernetes",2023,"","norma.ncirl.ie","https://norma.ncirl.ie/id/eprint/6491","https://scholar.google.com/scholar?cites=14674802377976983892&as_sdt=2005&sciodt=2007&hl=en",19,"2026-05-16 00:44:33","","","",,,,,,7,2.33,7,1,3,"Containers eliminate the need for manual deployment by using images that have already been constructed. However, the images that are associated with a particular service have a …","https://norma.ncirl.ie/6491/1/prawalsaxena.pdf","https://scholar.google.com/scholar?q=related:VDFgKANfp8sJ:scholar.google.com/&scioq=%22kubernetes+security%22%7C%22kubernetes+admission+control%22+%22sbom%22%7C%22cyclonedx%22%7C%22spdx%22&hl=en&as_sdt=2007&as_ylo=2020&as_yhi=2025"
0,"V Martínez Bevià","Securing Kubernetes in public cloud environments",2023,"","openaccess.uoc.edu","https://openaccess.uoc.edu/handle/10609/148751","",20,"2026-05-16 00:44:33","","","",,,,,,0,0.00,0,1,3,"… In this work though, we will focus on the parts of those surveys that deal with Kubernetes security incidents. We have some surveys, like the ones from RedHat and PaloAlto, that focus …","https://openaccess.uoc.edu/bitstream/10609/148751/1/vicmarbevFMDP0623report.pdf","https://scholar.google.com/scholar?q=related:nw6CC4SgA4UJ:scholar.google.com/&scioq=%22kubernetes+security%22%7C%22kubernetes+admission+control%22+%22sbom%22%7C%22cyclonedx%22%7C%22spdx%22&hl=en&as_sdt=2007&as_ylo=2020&as_yhi=2025"
0,"AG Rossi","Cloud-Native Security and Observability Frameworks for Modern Digital Transformation Initiatives",2025,"International Journal of Computer Technology and …","ijctece.com","https://ijctece.com/index.php/IJCTEC/article/view/597","",21,"2026-05-16 00:44:33","","","",,,,,,0,0.00,0,1,1,"… Container security and Kubernetes security have also become essential components of cloud-… Blockchain-enabled trust verification and secure software bill of materials (SBOM) systems …","https://ijctece.com/index.php/IJCTEC/article/download/597/542","https://scholar.google.com/scholar?q=related:YiAZKHMZhOkJ:scholar.google.com/&scioq=%22kubernetes+security%22%7C%22kubernetes+admission+control%22+%22sbom%22%7C%22cyclonedx%22%7C%22spdx%22&hl=en&as_sdt=2007&as_ylo=2020&as_yhi=2025"
2,"G Pujolle","Internet of edges architecture for 6G",2023,"2023 2nd International Conference on 6G …","ieeexplore.ieee.org","https://ieeexplore.ieee.org/abstract/document/10317768/","https://scholar.google.com/scholar?cites=6951380607253272504&as_sdt=2005&sciodt=2007&hl=en",22,"2026-05-16 00:44:33","","","",,,,,,2,0.67,2,1,3,"The objective of this paper is to propose a 6G architecture based on trust zones called Edges. An Edge is built with nodes integrating small data centers so that a very large part of the …","","https://scholar.google.com/scholar?q=related:uNfeEdVDeGAJ:scholar.google.com/&scioq=%22kubernetes+security%22%7C%22kubernetes+admission+control%22+%22sbom%22%7C%22cyclonedx%22%7C%22spdx%22&hl=en&as_sdt=2007&as_ylo=2020&as_yhi=2025"
0,"N Chockalingam, SK Chintham, A Deshpande…","Privacy-Aware Architectures for Cloud-Native Applications: A Systematic Review",2025,"","philpapers.org","https://philpapers.org/rec/CHOPAF-2","",23,"2026-05-16 00:44:33","","","",,,,,,0,0.00,0,4,1,"… Red Hat’s 2024 Kubernetes Security Report found that 87% of container images contain high or critical vulnerabilities, though this figure may reflect reporting bias toward organizations …","https://philarchive.org/archive/CHOPAF-2","https://scholar.google.com/scholar?q=related:6PnAdK7QpiwJ:scholar.google.com/&scioq=%22kubernetes+security%22%7C%22kubernetes+admission+control%22+%22sbom%22%7C%22cyclonedx%22%7C%22spdx%22&hl=en&as_sdt=2007&as_ylo=2020&as_yhi=2025"
0,"A James, A Temidayo","Container Image Security: Best Practices and Tools",2024,"","researchgate.net","https://www.researchgate.net/profile/Andrew-James-42/publication/391017904_Container_Image_Security_Best_Practices_and_Tools/links/680832cad1054b0207dc2ff5/Container-Image-Security-Best-Practices-and-Tools.pdf","",24,"2026-05-16 00:44:33","PDF","","",,,,,,0,0.00,0,2,2,"… Anchore and Grype offered detailed SBOM (Software Bill of Materials) generation but … tools into a CI/CD pipeline and Kubernetes admission control workflows is necessary. Successful …","https://www.researchgate.net/profile/Andrew-James-42/publication/391017904_Container_Image_Security_Best_Practices_and_Tools/links/680832cad1054b0207dc2ff5/Container-Image-Security-Best-Practices-and-Tools.pdf","https://scholar.google.com/scholar?q=related:deOFc8PvILcJ:scholar.google.com/&scioq=%22kubernetes+security%22%7C%22kubernetes+admission+control%22+%22sbom%22%7C%22cyclonedx%22%7C%22spdx%22&hl=en&as_sdt=2007&as_ylo=2020&as_yhi=2025"
3,"AD Keromytis","Recommendations from the workshop on open-source software security initiative",2022,"Georgia Institute of Technology, Tech. Rep","drive.google.com","https://drive.google.com/file/d/1LWolLX_ndH0DiHDOYViw2RcfQJtMvjOS/view","https://scholar.google.com/scholar?cites=6727983363687446760&as_sdt=2005&sciodt=2007&hl=en",25,"2026-05-16 00:44:33","PDF","","",,,,,,3,0.75,3,1,4,"… in an SBOM. At a minimum, software manifests should include transitive dependencies. Ideally, the SBOM … ” of software is sorely needed and needs to be integrated with SBOM tooling. …","https://drive.google.com/file/d/1LWolLX_ndH0DiHDOYViw2RcfQJtMvjOS/view","https://scholar.google.com/scholar?q=related:6PhTDzmZXl0J:scholar.google.com/&scioq=%22kubernetes+security%22%7C%22kubernetes+admission+control%22+%22sbom%22%7C%22cyclonedx%22%7C%22spdx%22&hl=en&as_sdt=2007&as_ylo=2020&as_yhi=2025"
0,"A Galanou, F Lubitz, H Jeon, C Fetzer…","Full Trust Alchemist: Reforging Attestation for Cloud-based Confidential Workloads",2025,"Proceedings of the 26th …","dl.acm.org","https://dl.acm.org/doi/abs/10.1145/3721462.3770778","",26,"2026-05-16 00:44:33","","10.1145/3721462.3770778","",,,,,,0,0.00,0,5,1,"… of the SBOM generation process itself. In contrast, our architecture enforces access control over SBOM creation by restricting its execution to the trusted policy enforcer. The SBOM is …","https://dl.acm.org/doi/pdf/10.1145/3721462.3770778","https://scholar.google.com/scholar?q=related:fcVnMpZkzSwJ:scholar.google.com/&scioq=%22kubernetes+security%22%7C%22kubernetes+admission+control%22+%22sbom%22%7C%22cyclonedx%22%7C%22spdx%22&hl=en&as_sdt=2007&as_ylo=2020&as_yhi=2025"
0,"A Controller, A Inventory","Glossary of Cloud and Container Security Terms",2025,"","Wiley Online Library","https://onlinelibrary.wiley.com/doi/chapter-epub/10.1002/9781394352456.app1","",27,"2026-05-16 00:44:33","","10.1002/9781394352456.app1","",,,,,,0,0.00,0,2,1,"… Admission Controller—A Kubernetes security component that intercepts API requests and … Pod Security Admission (PSA)—A Kubernetes security feature that enforces pod security …","","https://scholar.google.com/scholar?q=related:y_Yk1Wu8NkgJ:scholar.google.com/&scioq=%22kubernetes+security%22%7C%22kubernetes+admission+control%22+%22sbom%22%7C%22cyclonedx%22%7C%22spdx%22&hl=en&as_sdt=2007&as_ylo=2020&as_yhi=2025"
19,"R Alboqmi, RF Gamble","Enhancing microservice security through vulnerability-driven trust in the service mesh architecture",2025,"Sensors","mdpi.com","https://www.mdpi.com/1424-8220/25/3/914","https://scholar.google.com/scholar?cites=449651878087793256&as_sdt=2005&sciodt=2007&hl=en",28,"2026-05-16 00:44:33","HTML","","",,,,,,19,19.00,10,2,1,"… images are deployed, software bill of materials (SBOM) analysis for documenting all components in a … An SBOM assists in identifying vulnerabilities during incident response, ensuring …","https://www.mdpi.com/1424-8220/25/3/914","https://scholar.google.com/scholar?q=related:aJoCMgB8PQYJ:scholar.google.com/&scioq=%22kubernetes+security%22%7C%22kubernetes+admission+control%22+%22sbom%22%7C%22cyclonedx%22%7C%22spdx%22&hl=en&as_sdt=2007&as_ylo=2020&as_yhi=2025"
8,"AS George, T Baskar, PB Srikaanth","Bridging the Security Skills Gap: A Comprehensive Framework for Developing Application Security Competencies in Modern Software Engineering",2025,"Partners Universal Innovative …","puirp.com","https://puirp.com/index.php/research/article/view/118","https://scholar.google.com/scholar?cites=8747777466012226319&as_sdt=2005&sciodt=2007&hl=en",29,"2026-05-16 00:44:33","","","",,,,,,8,8.00,3,3,1,"… Software Bill of Materials (SBOM) generation and analysis provide comprehensive visibility … Container and Kubernetes security competencies are becoming essential as organizations …","https://puirp.com/index.php/research/article/download/118/102","https://scholar.google.com/scholar?q=related:D1PT80FZZnkJ:scholar.google.com/&scioq=%22kubernetes+security%22%7C%22kubernetes+admission+control%22+%22sbom%22%7C%22cyclonedx%22%7C%22spdx%22&hl=en&as_sdt=2007&as_ylo=2020&as_yhi=2025"
1,"R Osnat","Rethinking security with cloud native in mind",2023,"Computer Fraud &Security","magonlinelibrary.com","https://www.magonlinelibrary.com/doi/full/10.12968/S1361-3723(23)70009-2","https://scholar.google.com/scholar?cites=1837408784865927901&as_sdt=2005&sciodt=2007&hl=en",30,"2026-05-16 00:44:33","","10.12968/S1361-3723(23)70009-2","",,,,,,1,0.33,1,1,3,"… Everything from shift-left artefact scanning, CSPM and Kubernetes security posture … SBOM, together with automated alerts and acceptance gates along the entire code and build stages. …","","https://scholar.google.com/scholar?q=related:3aIdCY7JfxkJ:scholar.google.com/&scioq=%22kubernetes+security%22%7C%22kubernetes+admission+control%22+%22sbom%22%7C%22cyclonedx%22%7C%22spdx%22&hl=en&as_sdt=2007&as_ylo=2020&as_yhi=2025"
0,"Ν Κόκκαλης","Ασφάλεια και αξιοπιστία σε υποδομή μέσω κώδικα: μελέτη περίπτωσης δηλωτικής προσέγγισης",2024,"","dione.lib.unipi.gr","https://dione.lib.unipi.gr/xmlui/handle/unipi/17222","",31,"2026-05-16 00:44:33","","","",,,,,,0,0.00,0,1,2,"… o Διατήρηση του SBOM και ενημέρωση για νέες ευπάθειες σε libraries. Αυτή η λίστα ελέγχου προσφέρει ένα συνολικό πλαίσιο για τη διασφάλιση της απόδοσης, της ασφάλειας και της …","https://dione.lib.unipi.gr/xmlui/bitstream/handle/unipi/17222/Kokkalis_mpksa20001.pdf?sequence=1","https://scholar.google.com/scholar?q=related:FTIs_fx0X1YJ:scholar.google.com/&scioq=%22kubernetes+security%22%7C%22kubernetes+admission+control%22+%22sbom%22%7C%22cyclonedx%22%7C%22spdx%22&hl=en&as_sdt=2007&as_ylo=2020&as_yhi=2025"
0,"G Brunner","InstallTrust Score: Universal Trust Metrics for Software Installation",2025,"","raw.githubusercontent.com","https://raw.githubusercontent.com/code-agents/installtrust/main/installtrust-paper.pdf","",32,"2026-05-16 00:44:33","PDF","","",,,,,,0,0.00,0,1,1,"… Recent frameworks like Software Bill of Materials (SBOM) requirements [9] address … Kubernetes security audit third annual report. Cloud Native Computing Foundation, 2024. …","https://raw.githubusercontent.com/code-agents/installtrust/main/installtrust-paper.pdf","https://scholar.google.com/scholar?q=related:sM64fhQ0oKIJ:scholar.google.com/&scioq=%22kubernetes+security%22%7C%22kubernetes+admission+control%22+%22sbom%22%7C%22cyclonedx%22%7C%22spdx%22&hl=en&as_sdt=2007&as_ylo=2020&as_yhi=2025"
