Cites,Authors,Title,Year,Source,Publisher,ArticleURL,CitesURL,GSRank,QueryDate,Type,DOI,ISSN,CitationURL,Volume,Issue,StartPage,EndPage,ECC,CitesPerYear,CitesPerAuthor,AuthorCount,Age,Abstract,FullTextURL,RelatedURL
37,"LS Datla, RK Thodupunuri","Designing for Defense: How We Embedded Security Principles into Cloud-Native Web Application Architectures",2021,"International Journal of Emerging Research in …","ijeret.org","https://ijeret.org/index.php/ijeret/article/view/136","https://scholar.google.com/scholar?cites=17323831514092699431&as_sdt=2005&sciodt=2007&hl=en",270,"2026-05-16 00:43:55","","","",,,,,,37,7.40,19,2,5,"… Other than that, it was a source of traffic control, observability and policy enforcement through the control plane. Linkerd, a similar but lighter solution, was also examined for places …","https://ijeret.org/index.php/ijeret/article/download/136/125","https://scholar.google.com/scholar?q=related:J382-vmcavAJ:scholar.google.com/&scioq=%22kubernetes+security%22%7C%22kubernetes+admission+control%22+%22kyverno%22%7C%22opa+gatekeeper%22%7C%22policy+enforcement%22&hl=en&as_sdt=2007&as_ylo=2020&as_yhi=2025"
0,"H Caldwell, T Grayson, N Fedorov","Policy-Driven Infrastructure Governance Across Multi-Cloud and On-Prem Environments",2025,"","researchgate.net","https://www.researchgate.net/profile/Uthman-Usman-2/publication/403845759_Policy-Driven_Infrastructure_Governance_Across_Multi-Cloud_and_On-Prem_Environments/links/69dfe6eaceb1c90114ea43dc/Policy-Driven-Infrastructure-Governance-Across-Multi-Cloud-and-On-Prem-Environments.pdf","",271,"2026-05-16 00:43:55","PDF","","",,,,,,0,0.00,0,3,1,"The increasing complexity of managing infrastructure across multi-cloud and on-premises environments necessitates robust governance mechanisms that enforce organizational …","https://www.researchgate.net/profile/Uthman-Usman-2/publication/403845759_Policy-Driven_Infrastructure_Governance_Across_Multi-Cloud_and_On-Prem_Environments/links/69dfe6eaceb1c90114ea43dc/Policy-Driven-Infrastructure-Governance-Across-Multi-Cloud-and-On-Prem-Environments.pdf","https://scholar.google.com/scholar?q=related:cL5IBT_8YYIJ:scholar.google.com/&scioq=%22kubernetes+security%22%7C%22kubernetes+admission+control%22+%22kyverno%22%7C%22opa+gatekeeper%22%7C%22policy+enforcement%22&hl=en&as_sdt=2007&as_ylo=2020&as_yhi=2025"
0,"A Galanou, F Lubitz, H Jeon, C Fetzer…","Full Trust Alchemist: Reforging Attestation for Cloud-based Confidential Workloads",2025,"Proceedings of the 26th …","dl.acm.org","https://dl.acm.org/doi/abs/10.1145/3721462.3770778","",272,"2026-05-16 00:43:55","","10.1145/3721462.3770778","",,,,,,0,0.00,0,5,1,"… Its policy model is static and confined to startup, whereas we support continuous policy enforcement and attestation throughout workload execution. VERISMO [59] introduces a formally …","https://dl.acm.org/doi/pdf/10.1145/3721462.3770778","https://scholar.google.com/scholar?q=related:fcVnMpZkzSwJ:scholar.google.com/&scioq=%22kubernetes+security%22%7C%22kubernetes+admission+control%22+%22kyverno%22%7C%22opa+gatekeeper%22%7C%22policy+enforcement%22&hl=en&as_sdt=2007&as_ylo=2020&as_yhi=2025"
0,"I KOTORA","Post-Exploitation Tools for Limited Computing Environments",,"is.muni.cz","","https://is.muni.cz/th/z02zq/ivan_bc-12_Archive.pdf","",273,"2026-05-16 00:43:55","PDF","","",,,,,,0,0.00,0,1,,"This thesis addresses the challenges faced by penetration testers and security professionals in limited environments, where traditional tools and approaches are ineffective or …","https://is.muni.cz/th/z02zq/ivan_bc-12_Archive.pdf","https://scholar.google.com/scholar?q=related:sSOC8StCngoJ:scholar.google.com/&scioq=%22kubernetes+security%22%7C%22kubernetes+admission+control%22+%22kyverno%22%7C%22opa+gatekeeper%22%7C%22policy+enforcement%22&hl=en&as_sdt=2007&as_ylo=2020&as_yhi=2025"
1,"A Rajuroy, M Emmanuel","Optimizing Resource Management and Scalability in Container Orchestration Platforms: A Comparative Study",2025,"Journal or Archive (via ResearchGate)","researchgate.net","https://www.researchgate.net/profile/Adam-Rajuroy/publication/389853261_Optimizing_Resource_Management_and_Scalability_in_Container_Orchestration_Platforms_A_Comparative_Study/links/67d49e37be849d39d678f910/Optimizing-Resource-Management-and-Scalability-in-Container-Orchestration-Platforms-A-Comparative-Study.pdf","https://scholar.google.com/scholar?cites=5121423073534801630&as_sdt=2005&sciodt=2007&hl=en",274,"2026-05-16 00:43:55","PDF","","",,,,,,1,1.00,1,2,1,"Container orchestration platforms have become the backbone of modern cloud-native applications, enabling organizations to deploy, manage, and scale containerized workloads …","https://www.researchgate.net/profile/Adam-Rajuroy/publication/389853261_Optimizing_Resource_Management_and_Scalability_in_Container_Orchestration_Platforms_A_Comparative_Study/links/67d49e37be849d39d678f910/Optimizing-Resource-Management-and-Scalability-in-Container-Orchestration-Platforms-A-Comparative-Study.pdf","https://scholar.google.com/scholar?q=related:3vaHoibzEkcJ:scholar.google.com/&scioq=%22kubernetes+security%22%7C%22kubernetes+admission+control%22+%22kyverno%22%7C%22opa+gatekeeper%22%7C%22policy+enforcement%22&hl=en&as_sdt=2007&as_ylo=2020&as_yhi=2025"
0,"LMS CORREIA","Proteção de dados, gestão de identidade e deteção de incidentes em clusters kubernetes",2025,"","recipp.ipp.pt","https://recipp.ipp.pt/entities/publication/9c96a0ff-8b5e-424e-a2a7-1f170533c667","",275,"2026-05-16 00:43:55","","","",,,,,,0,0.00,0,1,1,"… pela comunidade para o estudo: OPA Gatekeeper; Kyverno; e k-rail. Neste projeto de investigação, os autores concluíram que o Gatekeeper e Kyverno são capazes de contemplar a …","https://recipp.ipp.pt/bitstreams/5fd9f616-b22d-435b-852a-6d56d6e50fb1/download","https://scholar.google.com/scholar?q=related:uzpXTmYoy7gJ:scholar.google.com/&scioq=%22kubernetes+security%22%7C%22kubernetes+admission+control%22+%22kyverno%22%7C%22opa+gatekeeper%22%7C%22policy+enforcement%22&hl=en&as_sdt=2007&as_ylo=2020&as_yhi=2025"
22,"S Ugale, A Potgantwar","Container security in cloud environments: A comprehensive analysis and future directions for devsecops",2023,"Engineering Proceedings","mdpi.com","https://www.mdpi.com/2673-4591/59/1/57","https://scholar.google.com/scholar?cites=5718147148395981788&as_sdt=2005&sciodt=2007&hl=en",276,"2026-05-16 00:43:55","HTML","","",,,,,,22,7.33,11,2,3,"… and deployment; and compliance and policy enforcement, whereby some scanning tools offer … Xi commandments of Kubernetes Security: A systematization of knowledge related to …","https://www.mdpi.com/2673-4591/59/1/57","https://scholar.google.com/scholar?q=related:3CuOEYnwWk8J:scholar.google.com/&scioq=%22kubernetes+security%22%7C%22kubernetes+admission+control%22+%22kyverno%22%7C%22opa+gatekeeper%22%7C%22policy+enforcement%22&hl=en&as_sdt=2007&as_ylo=2020&as_yhi=2025"
3,"Y Diogenes, T Janetscheck","Microsoft defender for cloud",2022,"","books.google.com","https://books.google.com/books?hl=en&lr=&id=LNfPEAAAQBAJ&oi=fnd&pg=PP18&dq=%22kubernetes+security%22%7C%22kubernetes+admission+control%22+%22kyverno%22%7C%22opa+gatekeeper%22%7C%22policy+enforcement%22&ots=qaaghYsS2x&sig=EU7hp_6TLDP8iC_ZPvW8CIcqQgw","https://scholar.google.com/scholar?cites=5344623634272851771&as_sdt=2005&sciodt=2007&hl=en",277,"2026-05-16 00:43:55","BOOK","","",,,,,,3,0.75,2,2,4,"… and systematically reduce their attack surfaces Prioritize risks with Secure Score, and leverage at-scale tools to build secure cloud-native apps Establish consistent policy enforcement …","","https://scholar.google.com/scholar?q=related:O5f92uDqK0oJ:scholar.google.com/&scioq=%22kubernetes+security%22%7C%22kubernetes+admission+control%22+%22kyverno%22%7C%22opa+gatekeeper%22%7C%22policy+enforcement%22&hl=en&as_sdt=2007&as_ylo=2020&as_yhi=2025"
6,"S Joshi","A Review of Generative AI and DevOps Pipelines: CI/CD, Agentic Automation, MLOps Integration, and LLMs",2025,"","philarchive.org","https://philarchive.org/rec/JOSARO-2","https://scholar.google.com/scholar?cites=3920622626445387145&as_sdt=2005&sciodt=2007&hl=en",278,"2026-05-16 00:43:55","","","",,,,,,6,6.00,6,1,1,"This paper presents a comprehensive review of Generative AI applications in DevOps automation, covering 50 key research works published between 2023-2025. By synthesizing …","https://philpapers.org/archive/JOSARO-2.pdf","https://scholar.google.com/scholar?q=related:ieWio4HZaDYJ:scholar.google.com/&scioq=%22kubernetes+security%22%7C%22kubernetes+admission+control%22+%22kyverno%22%7C%22opa+gatekeeper%22%7C%22policy+enforcement%22&hl=en&as_sdt=2007&as_ylo=2020&as_yhi=2025"
19,"R Alboqmi, RF Gamble","Enhancing microservice security through vulnerability-driven trust in the service mesh architecture",2025,"Sensors","mdpi.com","https://www.mdpi.com/1424-8220/25/3/914","https://scholar.google.com/scholar?cites=449651878087793256&as_sdt=2005&sciodt=2007&hl=en",279,"2026-05-16 00:43:55","HTML","","",,,,,,19,19.00,10,2,1,"… microservice management, real-time policy enforcement, and self-adaptive security … communications [14] and using sidecars as policy enforcement points [15]. The pivotal role of the …","https://www.mdpi.com/1424-8220/25/3/914","https://scholar.google.com/scholar?q=related:aJoCMgB8PQYJ:scholar.google.com/&scioq=%22kubernetes+security%22%7C%22kubernetes+admission+control%22+%22kyverno%22%7C%22opa+gatekeeper%22%7C%22policy+enforcement%22&hl=en&as_sdt=2007&as_ylo=2020&as_yhi=2025"
2,"M Levan","50 Kubernetes Concepts Every DevOps Engineer Should Know: Your go-to guide for making production-level decisions on how and why to implement …",2023,"","books.google.com","https://books.google.com/books?hl=en&lr=&id=brWqEAAAQBAJ&oi=fnd&pg=PP1&dq=%22kubernetes+security%22%7C%22kubernetes+admission+control%22+%22kyverno%22%7C%22opa+gatekeeper%22%7C%22policy+enforcement%22&ots=q1X7Y8GoPc&sig=yFkV22SjOIAVGZdsU7kF9adypbA","https://scholar.google.com/scholar?cites=7067602154771034598&as_sdt=2005&sciodt=2007&hl=en",280,"2026-05-16 00:43:55","BOOK","","",,,,,,2,0.67,2,1,3,"… applicationsDeploy apps in different states, including Stateless and StatefulMonitor and implement observability in your environmentExplore the functioning of Kubernetes security at the …","","https://scholar.google.com/scholar?q=related:5rHpyLYqFWIJ:scholar.google.com/&scioq=%22kubernetes+security%22%7C%22kubernetes+admission+control%22+%22kyverno%22%7C%22opa+gatekeeper%22%7C%22policy+enforcement%22&hl=en&as_sdt=2007&as_ylo=2020&as_yhi=2025"
0,"LMS CORREIA","Proteção de dados, gestão de identidade e deteção de incidentes em clusters kubernetes",2025,"","recipp.ipp.pt","https://recipp.ipp.pt/entities/publication/9c96a0ff-8b5e-424e-a2a7-1f170533c667","",281,"2026-05-16 00:43:55","","","",,,,,,0,0.00,0,1,1,"… pela comunidade para o estudo: OPA Gatekeeper; Kyverno; e k-rail. Neste projeto de investigação, os autores concluíram que o Gatekeeper e Kyverno são capazes de contemplar a …","https://recipp.ipp.pt/bitstreams/5fd9f616-b22d-435b-852a-6d56d6e50fb1/download","https://scholar.google.com/scholar?q=related:uzpXTmYoy7gJ:scholar.google.com/&scioq=%22kubernetes+security%22%7C%22kubernetes+admission+control%22+%22kyverno%22%7C%22opa+gatekeeper%22%7C%22policy+enforcement%22&hl=en&as_sdt=2007&as_ylo=2020&as_yhi=2025"
22,"S Ugale, A Potgantwar","Container security in cloud environments: A comprehensive analysis and future directions for devsecops",2023,"Engineering Proceedings","mdpi.com","https://www.mdpi.com/2673-4591/59/1/57","https://scholar.google.com/scholar?cites=5718147148395981788&as_sdt=2005&sciodt=2007&hl=en",282,"2026-05-16 00:43:55","HTML","","",,,,,,22,7.33,11,2,3,"… and deployment; and compliance and policy enforcement, whereby some scanning tools offer … Xi commandments of Kubernetes Security: A systematization of knowledge related to …","https://www.mdpi.com/2673-4591/59/1/57","https://scholar.google.com/scholar?q=related:3CuOEYnwWk8J:scholar.google.com/&scioq=%22kubernetes+security%22%7C%22kubernetes+admission+control%22+%22kyverno%22%7C%22opa+gatekeeper%22%7C%22policy+enforcement%22&hl=en&as_sdt=2007&as_ylo=2020&as_yhi=2025"
3,"Y Diogenes, T Janetscheck","Microsoft defender for cloud",2022,"","books.google.com","https://books.google.com/books?hl=en&lr=&id=LNfPEAAAQBAJ&oi=fnd&pg=PP18&dq=%22kubernetes+security%22%7C%22kubernetes+admission+control%22+%22kyverno%22%7C%22opa+gatekeeper%22%7C%22policy+enforcement%22&ots=qaaghYsS3C&sig=Vw0gkThRN8G8on_G3gusDGgcV30","https://scholar.google.com/scholar?cites=5344623634272851771&as_sdt=2005&sciodt=2007&hl=en",283,"2026-05-16 00:43:55","BOOK","","",,,,,,3,0.75,2,2,4,"… and systematically reduce their attack surfaces Prioritize risks with Secure Score, and leverage at-scale tools to build secure cloud-native apps Establish consistent policy enforcement …","","https://scholar.google.com/scholar?q=related:O5f92uDqK0oJ:scholar.google.com/&scioq=%22kubernetes+security%22%7C%22kubernetes+admission+control%22+%22kyverno%22%7C%22opa+gatekeeper%22%7C%22policy+enforcement%22&hl=en&as_sdt=2007&as_ylo=2020&as_yhi=2025"
6,"S Joshi","A Review of Generative AI and DevOps Pipelines: CI/CD, Agentic Automation, MLOps Integration, and LLMs",2025,"","philarchive.org","https://philarchive.org/rec/JOSARO-2","https://scholar.google.com/scholar?cites=3920622626445387145&as_sdt=2005&sciodt=2007&hl=en",284,"2026-05-16 00:43:55","","","",,,,,,6,6.00,6,1,1,"This paper presents a comprehensive review of Generative AI applications in DevOps automation, covering 50 key research works published between 2023-2025. By synthesizing …","https://philpapers.org/archive/JOSARO-2.pdf","https://scholar.google.com/scholar?q=related:ieWio4HZaDYJ:scholar.google.com/&scioq=%22kubernetes+security%22%7C%22kubernetes+admission+control%22+%22kyverno%22%7C%22opa+gatekeeper%22%7C%22policy+enforcement%22&hl=en&as_sdt=2007&as_ylo=2020&as_yhi=2025"
19,"R Alboqmi, RF Gamble","Enhancing microservice security through vulnerability-driven trust in the service mesh architecture",2025,"Sensors","mdpi.com","https://www.mdpi.com/1424-8220/25/3/914","https://scholar.google.com/scholar?cites=449651878087793256&as_sdt=2005&sciodt=2007&hl=en",285,"2026-05-16 00:43:55","HTML","","",,,,,,19,19.00,10,2,1,"… microservice management, real-time policy enforcement, and self-adaptive security … communications [14] and using sidecars as policy enforcement points [15]. The pivotal role of the …","https://www.mdpi.com/1424-8220/25/3/914","https://scholar.google.com/scholar?q=related:aJoCMgB8PQYJ:scholar.google.com/&scioq=%22kubernetes+security%22%7C%22kubernetes+admission+control%22+%22kyverno%22%7C%22opa+gatekeeper%22%7C%22policy+enforcement%22&hl=en&as_sdt=2007&as_ylo=2020&as_yhi=2025"
2,"M Levan","50 Kubernetes Concepts Every DevOps Engineer Should Know: Your go-to guide for making production-level decisions on how and why to implement …",2023,"","books.google.com","https://books.google.com/books?hl=en&lr=&id=brWqEAAAQBAJ&oi=fnd&pg=PP1&dq=%22kubernetes+security%22%7C%22kubernetes+admission+control%22+%22kyverno%22%7C%22opa+gatekeeper%22%7C%22policy+enforcement%22&ots=q1X7Y8GoQh&sig=A7362W388PDbCPCI4GNPsipDLYA","https://scholar.google.com/scholar?cites=7067602154771034598&as_sdt=2005&sciodt=2007&hl=en",286,"2026-05-16 00:43:55","BOOK","","",,,,,,2,0.67,2,1,3,"… applicationsDeploy apps in different states, including Stateless and StatefulMonitor and implement observability in your environmentExplore the functioning of Kubernetes security at the …","","https://scholar.google.com/scholar?q=related:5rHpyLYqFWIJ:scholar.google.com/&scioq=%22kubernetes+security%22%7C%22kubernetes+admission+control%22+%22kyverno%22%7C%22opa+gatekeeper%22%7C%22policy+enforcement%22&hl=en&as_sdt=2007&as_ylo=2020&as_yhi=2025"
0,"A Costan","Cognitive AI for Autonomous Security Operations Hybrid Threat Detection Intrusion Avoidance and SOC Resilience in Cloud-Native Ecosystems",2024,"International Journal of Research and Applied …","ijrai.org","https://www.ijrai.org/index.php/ijrai/article/view/448","",287,"2026-05-16 00:43:55","","","",,,,,,0,0.00,0,1,2,"… AI-driven policy enforcement engines mitigate such risks by continuously scanning … AI with zero-trust architectures, enabling dynamic policy enforcement based on real-time risk scoring. …","https://www.ijrai.org/index.php/ijrai/article/download/448/416","https://scholar.google.com/scholar?q=related:rmjPQSyx4dgJ:scholar.google.com/&scioq=%22kubernetes+security%22%7C%22kubernetes+admission+control%22+%22kyverno%22%7C%22opa+gatekeeper%22%7C%22policy+enforcement%22&hl=en&as_sdt=2007&as_ylo=2020&as_yhi=2025"
8,"G Dasher, I Envid, B Calder","Architectures for protecting cloud data planes",2022,"arXiv preprint arXiv:2201.13010","arxiv.org","https://arxiv.org/abs/2201.13010","https://scholar.google.com/scholar?cites=3181877844721446822&as_sdt=2005&sciodt=2007&hl=en",288,"2026-05-16 00:43:55","","","",,,,,,8,2.00,3,3,4,"… to provide visibility into the policy enforcement for debugging. The … These best practices for Kubernetes security, layer into the … This allows policy enforcement points for both consumer …","https://arxiv.org/pdf/2201.13010","https://scholar.google.com/scholar?q=related:pq9OnQpNKCwJ:scholar.google.com/&scioq=%22kubernetes+security%22%7C%22kubernetes+admission+control%22+%22kyverno%22%7C%22opa+gatekeeper%22%7C%22policy+enforcement%22&hl=en&as_sdt=2007&as_ylo=2020&as_yhi=2025"
0,"AK Gangula, AR Gangula","MULTI-TENANT CLOUD MODELS FOR HIGH-PERFORMANCE, SECURE, AND SCALABLE SERVICE DELIVERY ARCHITECTURES",,"researchgate.net","","https://www.researchgate.net/profile/Arun-K-Gangula/publication/403771525_MULTI-TENANT_CLOUD_MODELS_FOR_HIGH-PERFORMANCE_SECURE_AND_SCALABLE_SERVICE_DELIVERY_ARCHITECTURES/links/69dd0387c203cd5e3417d1a0/MULTI-TENANT-CLOUD-MODELS-FOR-HIGH-PERFORMANCE-SECURE-AND-SCALABLE-SERVICE-DELIVERY-ARCHITECTURES.pdf","",289,"2026-05-16 00:43:55","PDF","","",,,,,,0,0.00,0,2,,"Cloud computing relies on multi-tenancy as its fundamental capability to enable different customers to utilize shared infrastructure, platforms, and applications. The analysis evaluates …","https://www.researchgate.net/profile/Arun-K-Gangula/publication/403771525_MULTI-TENANT_CLOUD_MODELS_FOR_HIGH-PERFORMANCE_SECURE_AND_SCALABLE_SERVICE_DELIVERY_ARCHITECTURES/links/69dd0387c203cd5e3417d1a0/MULTI-TENANT-CLOUD-MODELS-FOR-HIGH-PERFORMANCE-SECURE-AND-SCALABLE-SERVICE-DELIVERY-ARCHITECTURES.pdf","https://scholar.google.com/scholar?q=related:5rmpyupWYNcJ:scholar.google.com/&scioq=%22kubernetes+security%22%7C%22kubernetes+admission+control%22+%22kyverno%22%7C%22opa+gatekeeper%22%7C%22policy+enforcement%22&hl=en&as_sdt=2007&as_ylo=2020&as_yhi=2025"
16,"M You, J Nam, M Seo, S Shin","HELIOS: Hardware-assisted high-performance security extension for cloud networking",2023,"… of the 2023 ACM Symposium on Cloud …","dl.acm.org","https://dl.acm.org/doi/abs/10.1145/3620678.3624786","https://scholar.google.com/scholar?cites=16858540433312713377&as_sdt=2005&sciodt=2007&hl=en",290,"2026-05-16 00:43:55","","10.1145/3620678.3624786","",,,,,,16,5.33,4,4,3,"… Cilium [15], Calico [39], and Bastion [65] represent contemporary solutions that enable security policy enforcement for container traffic. These solutions, effectively restricting …","https://dl.acm.org/doi/pdf/10.1145/3620678.3624786","https://scholar.google.com/scholar?q=related:oQoqJzSR9ekJ:scholar.google.com/&scioq=%22kubernetes+security%22%7C%22kubernetes+admission+control%22+%22kyverno%22%7C%22opa+gatekeeper%22%7C%22policy+enforcement%22&hl=en&as_sdt=2007&as_ylo=2020&as_yhi=2025"
1,"P Josyula, A Kumar, G Hiremath","Survey of Big Data Architectures and Frameworks on Kubernetes: Challenges, Solutions, and Future Directions",2025,"2025 10th International …","ieeexplore.ieee.org","https://ieeexplore.ieee.org/abstract/document/11211300/","https://scholar.google.com/scholar?cites=9298303861383609716&as_sdt=2005&sciodt=2007&hl=en",291,"2026-05-16 00:43:55","","","",,,,,,1,1.00,0,3,1,"… Kubernetes-native policy engines like Open Policy Agent (OPA) allow governance policy enforcement for compliance maintenance. Latest advances in blockchain-based governance …","","https://scholar.google.com/scholar?q=related:dL1p7xg2CoEJ:scholar.google.com/&scioq=%22kubernetes+security%22%7C%22kubernetes+admission+control%22+%22kyverno%22%7C%22opa+gatekeeper%22%7C%22policy+enforcement%22&hl=en&as_sdt=2007&as_ylo=2020&as_yhi=2025"
14,"Y Cheng, M Xu, Y Zhang, K Li, H Wu, Y Zhang…","Say what you mean: Natural language access control with large language models for internet of things",2025,"arXiv preprint arXiv …","arxiv.org","https://arxiv.org/abs/2505.23835","https://scholar.google.com/scholar?cites=2584639259083865790&as_sdt=2005&sciodt=2007&hl=en",292,"2026-05-16 00:43:55","","","",,,,,,14,14.00,2,7,1,"… -aware policy enforcement across … Kubernetes admission control [17], web services [18], identity control [19], and CI/CD pipelines [20]. In this work, OPA serves as a policy enforcement …","https://arxiv.org/pdf/2505.23835","https://scholar.google.com/scholar?q=related:vv44TrZ73iMJ:scholar.google.com/&scioq=%22kubernetes+security%22%7C%22kubernetes+admission+control%22+%22kyverno%22%7C%22opa+gatekeeper%22%7C%22policy+enforcement%22&hl=en&as_sdt=2007&as_ylo=2020&as_yhi=2025"
0,"B Kumar, A Verma, P Verma","Storage and Networking",2025,"Modern Kubernetes: From Core Concepts to …","Springer","https://link.springer.com/chapter/10.1007/978-3-032-12972-7_13","",293,"2026-05-16 00:43:55","","10.1007/978-3-032-12972-7_13","",,,,,,0,0.00,0,3,1,"This chapter provides a comprehensive overview of Kubernetes storage and networking concepts. It begins with storage fundamentals, including persistent volumes and claims, …","","https://scholar.google.com/scholar?q=related:JjTsCwQ2-SYJ:scholar.google.com/&scioq=%22kubernetes+security%22%7C%22kubernetes+admission+control%22+%22kyverno%22%7C%22opa+gatekeeper%22%7C%22policy+enforcement%22&hl=en&as_sdt=2007&as_ylo=2020&as_yhi=2025"
0,"ME Torres Ponce","El Impacto de la Adopción de Kubernetes y GitOps en la Gobernanza del Cambio: Un análisis desde el paradigma post-COVID",2023,"Available at SSRN 5603512","papers.ssrn.com","https://papers.ssrn.com/sol3/papers.cfm?abstract_id=5603512","",294,"2026-05-16 00:43:55","","","",,,,,,0,0.00,0,1,3,"Spanish abstract: El presente trabajo analiza el impacto de la adopción de Kubernetes y GitOps en la gobernanza del cambio tecnológico, considerando tanto su dimensión técnica …","https://papers.ssrn.com/sol3/Delivery.cfm?abstractid=5603512","https://scholar.google.com/scholar?q=related:btMW7D0OPO4J:scholar.google.com/&scioq=%22kubernetes+security%22%7C%22kubernetes+admission+control%22+%22kyverno%22%7C%22opa+gatekeeper%22%7C%22policy+enforcement%22&hl=en&as_sdt=2007&as_ylo=2020&as_yhi=2025"
0,"RA Marín Sánchez","Securización y monitorización inicial de un clúster de Kubernetes",2023,"","openaccess.uoc.edu","https://openaccess.uoc.edu/handle/10609/147298","",295,"2026-05-16 00:43:55","","","",,,,,,0,0.00,0,1,3,"… Kyverno se ejecuta como una aplicación en el clúster y proporciona una interfaz de línea de comandos y una API para la gestión y aplicación políticas a los recursos de Kubernetes. …","https://openaccess.uoc.edu/bitstream/10609/147298/4/rafmarsanTFM0123memoria.pdf","https://scholar.google.com/scholar?q=related:RnVm-oUmHwcJ:scholar.google.com/&scioq=%22kubernetes+security%22%7C%22kubernetes+admission+control%22+%22kyverno%22%7C%22opa+gatekeeper%22%7C%22policy+enforcement%22&hl=en&as_sdt=2007&as_ylo=2020&as_yhi=2025"
1,"AA Asante","Strengthening Healthcare Cloud Security Using Cloud Workload Protection Platforms (CWPP): A Framework for Protecting Patient-Critical Workloads in Health Data …",2025,"… Journal of Research and Innovation in …","repository.gyaanarth.com","https://repository.gyaanarth.com/ijriss/9/11/strengthening-healthcare-cloud-security-using-cloud-workload-protection-platforms-cwpp-a-framework-for-protecting-patient-critical-workloads-in-health-data-warehouses-3862","https://scholar.google.com/scholar?cites=12071083064259985742&as_sdt=2005&sciodt=2007&hl=en",296,"2026-05-16 00:43:55","","","",,,,,,1,1.00,1,1,1,"This research presents a comprehensive CWPP-enabled framework tailored for securing healthcare cloud workloads, specifically focusing on cloud-based health data warehouses (…","https://repository.gyaanarth.com/pdfs/ijriss/vol9-iss11-pg7863-7889-202512_pdf.pdf","https://scholar.google.com/scholar?q=related:TkFzcxcahacJ:scholar.google.com/&scioq=%22kubernetes+security%22%7C%22kubernetes+admission+control%22+%22kyverno%22%7C%22opa+gatekeeper%22%7C%22policy+enforcement%22&hl=en&as_sdt=2007&as_ylo=2020&as_yhi=2025"
0,"J Walsh","IDENTITY SECURITY FOR SOFTWARE DEVELOPMENT: Building with Identity, Secrets, and Credentials",2025,"","books.google.com","https://books.google.com/books?hl=en&lr=&id=2qlbEQAAQBAJ&oi=fnd&pg=PP1&dq=%22kubernetes+security%22%7C%22kubernetes+admission+control%22+%22kyverno%22%7C%22opa+gatekeeper%22%7C%22policy+enforcement%22&ots=A6MBBrorFK&sig=HF7BkAEfaA1p2RDswwfxHj6AwGY","",297,"2026-05-16 00:43:55","BOOK","","",,,,,,0,0.00,0,1,1,"Maintaining secrets, credentials, and machine identities in secure ways is an important, though often overlooked, aspect of secure software development. DevOps security often …","","https://scholar.google.com/scholar?q=related:jZTdIuLm8DcJ:scholar.google.com/&scioq=%22kubernetes+security%22%7C%22kubernetes+admission+control%22+%22kyverno%22%7C%22opa+gatekeeper%22%7C%22policy+enforcement%22&hl=en&as_sdt=2007&as_ylo=2020&as_yhi=2025"
