Cites,Authors,Title,Year,Source,Publisher,ArticleURL,CitesURL,GSRank,QueryDate,Type,DOI,ISSN,CitationURL,Volume,Issue,StartPage,EndPage,ECC,CitesPerYear,CitesPerAuthor,AuthorCount,Age,Abstract,FullTextURL,RelatedURL
0,"H DE FLON, O SULAIMAN","Designing a Proactive Security Solution for Kubernetes Clusters",2025,"","odr.chalmers.se","https://odr.chalmers.se/server/api/core/bitstreams/7352f5cc-ad70-4c90-a2a7-9dc40f4fc3ed/content","",160,"2026-05-16 00:43:55","PDF","","",,,,,,0,0.00,0,2,1,"… Compared to this thesis, there is a certain resemblance, as we also work on Kubernetes security, … Other works have explored proactive security policy enforcement for containerized and …","https://odr.chalmers.se/server/api/core/bitstreams/7352f5cc-ad70-4c90-a2a7-9dc40f4fc3ed/content","https://scholar.google.com/scholar?q=related:yanzyiHfqhcJ:scholar.google.com/&scioq=%22kubernetes+security%22%7C%22kubernetes+admission+control%22+%22kyverno%22%7C%22opa+gatekeeper%22%7C%22policy+enforcement%22&hl=en&as_sdt=2007&as_ylo=2020&as_yhi=2025"
0,"M Mahzabin","Reliability-Aware Architecture Design for Cloud-Native Financial Systems Using Kubernetes and Infrastructure as Code",2025,"Available at SSRN 6232038","papers.ssrn.com","https://papers.ssrn.com/sol3/Delivery.cfm?abstractid=6232038","",161,"2026-05-16 00:43:55","PDF","","",,,,,,0,0.00,0,1,1,"… enforceable constraints through policy-as-code, applied at CI gates and Kubernetes admission control. The approach leverages a general policy engine model (eg, Open Policy Agent) …","https://papers.ssrn.com/sol3/Delivery.cfm?abstractid=6232038","https://scholar.google.com/scholar?q=related:XwPsSJa35mQJ:scholar.google.com/&scioq=%22kubernetes+security%22%7C%22kubernetes+admission+control%22+%22kyverno%22%7C%22opa+gatekeeper%22%7C%22policy+enforcement%22&hl=en&as_sdt=2007&as_ylo=2020&as_yhi=2025"
1,"A Oluwaferanmi","DevSecOps Implementation Strategies for Continuous Vulnerability Management in Large-Scale Enterprise Applications",2025,"","researchgate.net","https://www.researchgate.net/profile/Adam-Rajuroy/publication/393517743_DevSecOps_Implementation_Strategies_for_Continuous_Vulnerability_Management_in_Large-Scale_Enterprise_Applications/links/686e60f2e4632b045dcaddd8/DevSecOps-Implementation-Strategies-for-Continuous-Vulnerability-Management-in-Large-Scale-Enterprise-Applications.pdf","https://scholar.google.com/scholar?cites=9297338064799594439&as_sdt=2005&sciodt=2007&hl=en",162,"2026-05-16 00:43:55","PDF","","",,,,,,1,1.00,1,1,1,"The proliferation of large-scale enterprise applications in today’s hyperconnected digital ecosystems has necessitated rapid development cycles, heightened system complexity, and …","https://www.researchgate.net/profile/Adam-Rajuroy/publication/393517743_DevSecOps_Implementation_Strategies_for_Continuous_Vulnerability_Management_in_Large-Scale_Enterprise_Applications/links/686e60f2e4632b045dcaddd8/DevSecOps-Implementation-Strategies-for-Continuous-Vulnerability-Management-in-Large-Scale-Enterprise-Applications.pdf","https://scholar.google.com/scholar?q=related:x_cY5bXHBoEJ:scholar.google.com/&scioq=%22kubernetes+security%22%7C%22kubernetes+admission+control%22+%22kyverno%22%7C%22opa+gatekeeper%22%7C%22policy+enforcement%22&hl=en&as_sdt=2007&as_ylo=2020&as_yhi=2025"
0,"N Chockalingam, SK Chintham, A Deshpande…","Privacy-Aware Architectures for Cloud-Native Applications: A Systematic Review",2025,"","philpapers.org","https://philpapers.org/rec/CHOPAF-2","",163,"2026-05-16 00:43:55","","","",,,,,,0,0.00,0,4,1,"… We propose a layered privacy architecture incorporating Zero Trust principles, privacy-enhancing technologies, and adaptive policy enforcement to address these gaps. Our findings …","https://philarchive.org/archive/CHOPAF-2","https://scholar.google.com/scholar?q=related:6PnAdK7QpiwJ:scholar.google.com/&scioq=%22kubernetes+security%22%7C%22kubernetes+admission+control%22+%22kyverno%22%7C%22opa+gatekeeper%22%7C%22policy+enforcement%22&hl=en&as_sdt=2007&as_ylo=2020&as_yhi=2025"
0,"CM Rodriguez, GS Thompson","AI-Assisted Detection and Remediation of CIS Benchmark Violations on Kubernetes Worker Nodes",2023,"","researchgate.net","https://www.researchgate.net/profile/Naimat-Eniola/publication/403258599_AI-Assisted_Detection_and_Remediation_of_CIS_Benchmark_Violations_on_Kubernetes_Worker_Nodes/links/69c99bb09f53d47411c313e6/AI-Assisted-Detection-and-Remediation-of-CIS-Benchmark-Violations-on-Kubernetes-Worker-Nodes.pdf","",164,"2026-05-16 00:43:55","PDF","","",,,,,,0,0.00,0,2,3,"The widespread adoption of Kubernetes for container orchestration has introduced significant security complexities, particularly at the worker node level. Adherence to the Center for …","https://www.researchgate.net/profile/Naimat-Eniola/publication/403258599_AI-Assisted_Detection_and_Remediation_of_CIS_Benchmark_Violations_on_Kubernetes_Worker_Nodes/links/69c99bb09f53d47411c313e6/AI-Assisted-Detection-and-Remediation-of-CIS-Benchmark-Violations-on-Kubernetes-Worker-Nodes.pdf","https://scholar.google.com/scholar?q=related:m_BAZAnawiUJ:scholar.google.com/&scioq=%22kubernetes+security%22%7C%22kubernetes+admission+control%22+%22kyverno%22%7C%22opa+gatekeeper%22%7C%22policy+enforcement%22&hl=en&as_sdt=2007&as_ylo=2020&as_yhi=2025"
1,"A Hussain, A Aziz, S Hassan…","Preventing IP spoofing in Kubernetes using eBPF",2025,"Computers, Materials, & …","researchgate.net","https://www.researchgate.net/profile/Hassan-Syed/publication/392451218_Preventing_IP_Spoofing_in_Kubernetes_Using_eBPF/links/684fa7cd7869fe75c5595d50/Preventing-IP-Spoofing-in-Kubernetes-Using-eBPF.pdf","https://scholar.google.com/scholar?cites=1348702943305164968&as_sdt=2005&sciodt=2007&hl=en",165,"2026-05-16 00:43:55","PDF","","",,,,,,1,1.00,0,4,1,"… It enables IP address allocation, routing, and network policy enforcement without requiring a … A significant risk in Kubernetes security is IP spoofing, where attackers manipulate source …","https://www.researchgate.net/profile/Hassan-Syed/publication/392451218_Preventing_IP_Spoofing_in_Kubernetes_Using_eBPF/links/684fa7cd7869fe75c5595d50/Preventing-IP-Spoofing-in-Kubernetes-Using-eBPF.pdf","https://scholar.google.com/scholar?q=related:qGg6Yy6OtxIJ:scholar.google.com/&scioq=%22kubernetes+security%22%7C%22kubernetes+admission+control%22+%22kyverno%22%7C%22opa+gatekeeper%22%7C%22policy+enforcement%22&hl=en&as_sdt=2007&as_ylo=2020&as_yhi=2025"
0,"P Ngoc Thanh Hung","Leveraging eBPF for Enhanced Kubernetes Observability and Security",2025,"","norma.ncirl.ie","https://norma.ncirl.ie/8042/","",166,"2026-05-16 00:43:55","","","",,,,,,0,0.00,0,1,1,"… to the understanding of Kubernetes security through the … By employing security policy enforcement, the proposal of … in order to allow complete policy enforcement during runtime. This …","https://norma.ncirl.ie/8042/1/phamngocthanhhung.pdf","https://scholar.google.com/scholar?q=related:XE6tXsjX2ikJ:scholar.google.com/&scioq=%22kubernetes+security%22%7C%22kubernetes+admission+control%22+%22kyverno%22%7C%22opa+gatekeeper%22%7C%22policy+enforcement%22&hl=en&as_sdt=2007&as_ylo=2020&as_yhi=2025"
0,"A Medianov","Deploying FIWARE context broker automatically in Kubernetes environment",2025,"","theseus.fi","https://www.theseus.fi/handle/10024/889892","",167,"2026-05-16 00:43:55","","","",,,,,,0,0.00,0,1,1,"The objective of this thesis was to design and implement a method for automating the deployment process of the FIWARE Context Broker using modern practices and Kubernetes-native …","https://www.theseus.fi/bitstream/handle/10024/889892/Medianov_Artemii.pdf?sequence=2","https://scholar.google.com/scholar?q=related:B3lqgc0ym0EJ:scholar.google.com/&scioq=%22kubernetes+security%22%7C%22kubernetes+admission+control%22+%22kyverno%22%7C%22opa+gatekeeper%22%7C%22policy+enforcement%22&hl=en&as_sdt=2007&as_ylo=2020&as_yhi=2025"
2,"G Ananya, W David, A Samir","AI-Enhanced DevSecOps: Automating Vulnerability Management and Security Policy Enforcement in CI/CD Pipelines",2025,"Web of Semantics: Journal of …","eprints.umsida.ac.id","http://eprints.umsida.ac.id/16404/","https://scholar.google.com/scholar?cites=17843285186449919595&as_sdt=2005&sciodt=2007&hl=en",168,"2026-05-16 00:43:55","","","",,,,,,2,2.00,1,3,1,"… This article explores how artificial intelligence (AI)–enhanced DevSecOps can transform vulnerability management and policy enforcement. By leveraging machine learning for anomaly …","http://eprints.umsida.ac.id/16404/1/AI-Enhanced%20DevSecOps%20Automating%20Vulnerability.pdf","https://scholar.google.com/scholar?q=related:a05W3FYVoPcJ:scholar.google.com/&scioq=%22kubernetes+security%22%7C%22kubernetes+admission+control%22+%22kyverno%22%7C%22opa+gatekeeper%22%7C%22policy+enforcement%22&hl=en&as_sdt=2007&as_ylo=2020&as_yhi=2025"
0,"ACM SIGOPS","International Workshop on MetaOS for the Cloud-Edge-IoT Continuum",,"dl.acm.org","","https://dl.acm.org/doi/pdf/10.1145/3721889","",169,"2026-05-16 00:43:55","","10.1145/3721889","",,,,,,0,0.00,0,1,,"… Overall, our study aims to provide practical insights that can be quite useful for Kubernetes security and DevSecOps practitioners. The rest of the paper is organized as follows: In …","","https://scholar.google.com/scholar?q=related:IKcVOu4CN_AJ:scholar.google.com/&scioq=%22kubernetes+security%22%7C%22kubernetes+admission+control%22+%22kyverno%22%7C%22opa+gatekeeper%22%7C%22policy+enforcement%22&hl=en&as_sdt=2007&as_ylo=2020&as_yhi=2025"
3,"J Bufalino, JL Martin-Navarro, M Di Francesco…","Inside job: Defending kubernetes clusters against network misconfigurations",2025,"Proceedings of the …","dl.acm.org","https://dl.acm.org/doi/abs/10.1145/3749220","https://scholar.google.com/scholar?cites=4367269302137930237&as_sdt=2005&sciodt=2007&hl=en",170,"2026-05-16 00:43:55","","10.1145/3749220","",,,,,,3,3.00,1,4,1,"… Research on Kubernetes security has largely focused on hardening [70], risk assessment [… Open Policy Agent [26] is a general-purpose engine for policy enforcement; it offers native …","https://dl.acm.org/doi/pdf/10.1145/3749220","https://scholar.google.com/scholar?q=related:_UFmoEqomzwJ:scholar.google.com/&scioq=%22kubernetes+security%22%7C%22kubernetes+admission+control%22+%22kyverno%22%7C%22opa+gatekeeper%22%7C%22policy+enforcement%22&hl=en&as_sdt=2007&as_ylo=2020&as_yhi=2025"
0,"JGC de Carvalho Machado","Assurance and Compliance of Security Policies in Cloud Native Environments",2022,"","search.proquest.com","https://search.proquest.com/openview/4a961e8dca27d463f6344095373655df/1?pq-origsite=gscholar&cbl=2026366&diss=y","",171,"2026-05-16 00:43:55","","","",,,,,,0,0.00,0,1,4,"… We can take the example of OPA (Open Policy Agent) which integrates policy enforcement … most of the tools and technologies are more focused on Kubernetes security and compliance. …","","https://scholar.google.com/scholar?q=related:o_AOh3_z0OQJ:scholar.google.com/&scioq=%22kubernetes+security%22%7C%22kubernetes+admission+control%22+%22kyverno%22%7C%22opa+gatekeeper%22%7C%22policy+enforcement%22&hl=en&as_sdt=2007&as_ylo=2020&as_yhi=2025"
0,"S Rieger","EFFEKTIVITÄT VON ZERO-TRUST-ARCHITEKTUREN IN KUBERNETES-CLUSTERN",,"christiandechant.de","","https://christiandechant.de/Masterthesis.pdf","",172,"2026-05-16 00:43:55","PDF","","",,,,,,0,0.00,0,1,,"… Ein Computer (Subjekt) kommuniziert über die ungesicherte Zone mit dem Policy Decision Point und dem Policy Enforcement Point, die den Zugang zur Ressource in der impliziten …","https://christiandechant.de/Masterthesis.pdf","https://scholar.google.com/scholar?q=related:3jAq0MMfLcMJ:scholar.google.com/&scioq=%22kubernetes+security%22%7C%22kubernetes+admission+control%22+%22kyverno%22%7C%22opa+gatekeeper%22%7C%22policy+enforcement%22&hl=en&as_sdt=2007&as_ylo=2020&as_yhi=2025"
7,"SKR Anumandla","Automating container orchestration: Innovations and challenges in kubernetes implementation",2024,"Robotics Xplore: USA Tech Digest","hal.science","https://hal.science/hal-04787298/","https://scholar.google.com/scholar?cites=3355712144091824042&as_sdt=2005&sciodt=2007&hl=en",173,"2026-05-16 00:43:55","","","",,,,,,7,3.50,7,1,2,"… policy enforcement, secrets management, and audits should address security and compliance issues. Tools like Open Policy Agent (OPA) and Kubernetes Security Profiles Operator (…","https://hal.science/hal-04787298v1/file/2024.3.pdf","https://scholar.google.com/scholar?q=related:qr8ObWrikS4J:scholar.google.com/&scioq=%22kubernetes+security%22%7C%22kubernetes+admission+control%22+%22kyverno%22%7C%22opa+gatekeeper%22%7C%22policy+enforcement%22&hl=en&as_sdt=2007&as_ylo=2020&as_yhi=2025"
0,"AS Williams","EDGE COMPUTING SECURITY: PROTECTING APIS AND MICROSERVICES AT THE PERIMETER",2025,"","researchgate.net","https://www.researchgate.net/profile/Adams-Williams/publication/399079379_EDGE_COMPUTING_SECURITY_PROTECTING_APIS_AND_MICROSERVICES_AT_THE_PERIMETER/links/694e085906a9ab54f84ae0d4/EDGE-COMPUTING-SECURITY-PROTECTING-APIS-AND-MICROSERVICES-AT-THE-PERIMETER.pdf","",174,"2026-05-16 00:43:55","PDF","","",,,,,,0,0.00,0,1,1,"… and authorization mechanisms provide scalable, low-latency access control for microservices, while blockchainenabled smart contracts introduce immutable policy enforcement for …","https://www.researchgate.net/profile/Adams-Williams/publication/399079379_EDGE_COMPUTING_SECURITY_PROTECTING_APIS_AND_MICROSERVICES_AT_THE_PERIMETER/links/694e085906a9ab54f84ae0d4/EDGE-COMPUTING-SECURITY-PROTECTING-APIS-AND-MICROSERVICES-AT-THE-PERIMETER.pdf","https://scholar.google.com/scholar?q=related:cGng7iGMO4cJ:scholar.google.com/&scioq=%22kubernetes+security%22%7C%22kubernetes+admission+control%22+%22kyverno%22%7C%22opa+gatekeeper%22%7C%22policy+enforcement%22&hl=en&as_sdt=2007&as_ylo=2020&as_yhi=2025"
0,"C Wang, DL Martinez, E Cole","AI-Assisted Detection and Remediation of CIS Benchmark Violations in Kubernetes Worker Nodes",2024,"","researchgate.net","https://www.researchgate.net/profile/Bruce-William-2/publication/403461427_AI-Assisted_Detection_and_Remediation_of_CIS_Benchmark_Violations_in_Kubernetes_Worker_Nodes/links/69ceeb2c3c6189430673334f/AI-Assisted-Detection-and-Remediation-of-CIS-Benchmark-Violations-in-Kubernetes-Worker-Nodes.pdf","",175,"2026-05-16 00:43:55","PDF","","",,,,,,0,0.00,0,3,2,"… The results demonstrate the significant potential of AI-assisted frameworks for managing Kubernetes security compliance. The KubeArmor-AI system successfully automates a process …","https://www.researchgate.net/profile/Bruce-William-2/publication/403461427_AI-Assisted_Detection_and_Remediation_of_CIS_Benchmark_Violations_in_Kubernetes_Worker_Nodes/links/69ceeb2c3c6189430673334f/AI-Assisted-Detection-and-Remediation-of-CIS-Benchmark-Violations-in-Kubernetes-Worker-Nodes.pdf","https://scholar.google.com/scholar?q=related:M77oFb8dFREJ:scholar.google.com/&scioq=%22kubernetes+security%22%7C%22kubernetes+admission+control%22+%22kyverno%22%7C%22opa+gatekeeper%22%7C%22policy+enforcement%22&hl=en&as_sdt=2007&as_ylo=2020&as_yhi=2025"
0,"A Saldaña López","Diseño e implementación de un clúster Kubernetes seguro en AWS",2024,"","openaccess.uoc.edu","https://openaccess.uoc.edu/handle/10609/150608","",176,"2026-05-16 00:43:55","","","",,,,,,0,0.00,0,1,2,"… After that, we deployed security policies using Kyverno to ensure that all workloads meet the security requirements. Finally, we installed Falco to analyze logs and trigger alerts in real-…","https://openaccess.uoc.edu/bitstream/10609/150608/1/asaldanaTFM0624memoria.pdf","https://scholar.google.com/scholar?q=related:6f8xy0X1iJMJ:scholar.google.com/&scioq=%22kubernetes+security%22%7C%22kubernetes+admission+control%22+%22kyverno%22%7C%22opa+gatekeeper%22%7C%22policy+enforcement%22&hl=en&as_sdt=2007&as_ylo=2020&as_yhi=2025"
1,"JM de Jesus Silva","Zero trust security for microservices in scalable systems",2024,"","search.proquest.com","https://search.proquest.com/openview/8e0f6a10d7daec3d07a155da64bd816f/1?pq-origsite=gscholar&cbl=2026366&diss=y","https://scholar.google.com/scholar?cites=7185957129216088600&as_sdt=2005&sciodt=2007&hl=en",177,"2026-05-16 00:43:55","","","",,,,,,1,0.50,1,1,2,"… Application owners necessitate consistent and clear policy enforcement based on … While standard TLS primarily verifies server identity, comprehensive policy enforcement requires …","","https://scholar.google.com/scholar?q=related:GFocqu-luWMJ:scholar.google.com/&scioq=%22kubernetes+security%22%7C%22kubernetes+admission+control%22+%22kyverno%22%7C%22opa+gatekeeper%22%7C%22policy+enforcement%22&hl=en&as_sdt=2007&as_ylo=2020&as_yhi=2025"
0,"MK Avula","An Active Defense Security Framework using Deep Reinforcement Learning for Container-Based Architectures",2025,"","norma.ncirl.ie","https://norma.ncirl.ie/id/eprint/8083","",178,"2026-05-16 00:43:55","","","",,,,,,0,0.00,0,1,1,"… architecture for consistent security policy enforcement. … This study fills a large gap in Kubernetes security by moving … The relevance of this study to Kubernetes security is profound as it …","https://norma.ncirl.ie/8083/1/maheshkumaravula.pdf","https://scholar.google.com/scholar?q=related:aNNuOj0boR8J:scholar.google.com/&scioq=%22kubernetes+security%22%7C%22kubernetes+admission+control%22+%22kyverno%22%7C%22opa+gatekeeper%22%7C%22policy+enforcement%22&hl=en&as_sdt=2007&as_ylo=2020&as_yhi=2025"
0,"AG Rossi","Cloud-Native Security and Observability Frameworks for Modern Digital Transformation Initiatives",2025,"International Journal of Computer Technology and …","ijctece.com","https://ijctece.com/index.php/IJCTEC/article/view/597","",179,"2026-05-16 00:43:55","","","",,,,,,0,0.00,0,1,1,"… Container security and Kubernetes security have also become essential components of … Organizations must implement runtime security monitoring, image scanning, policy enforcement, …","https://ijctece.com/index.php/IJCTEC/article/download/597/542","https://scholar.google.com/scholar?q=related:YiAZKHMZhOkJ:scholar.google.com/&scioq=%22kubernetes+security%22%7C%22kubernetes+admission+control%22+%22kyverno%22%7C%22opa+gatekeeper%22%7C%22policy+enforcement%22&hl=en&as_sdt=2007&as_ylo=2020&as_yhi=2025"
0,"A Meriwether, C Reyes, E Petrov, H Desai, J Carlisle…","Automating CIS Compliance Validation in Kubernetes Worker Nodes Using Continuous Security Pipelines",2023,"","researchgate.net","https://www.researchgate.net/profile/Uthman-Usman-2/publication/404197647_Automating_CIS_Compliance_Validation_in_Kubernetes_Worker_Nodes_Using_Continuous_Security_Pipelines/links/69ed0a83acd3d67d710054fc/Automating-CIS-Compliance-Validation-in-Kubernetes-Worker-Nodes-Using-Continuous-Security-Pipelines.pdf","",180,"2026-05-16 00:43:55","PDF","","",,,,,,0,0.00,0,6,3,"… , Kube-hunter) and admission controllers (OPA Gatekeeper, Kyverno). However, these are typically … Kubernetes security: A comprehensive guide to secure Kubernetes clusters. Packt …","https://www.researchgate.net/profile/Uthman-Usman-2/publication/404197647_Automating_CIS_Compliance_Validation_in_Kubernetes_Worker_Nodes_Using_Continuous_Security_Pipelines/links/69ed0a83acd3d67d710054fc/Automating-CIS-Compliance-Validation-in-Kubernetes-Worker-Nodes-Using-Continuous-Security-Pipelines.pdf","https://scholar.google.com/scholar?q=related:fpM_xne2tEIJ:scholar.google.com/&scioq=%22kubernetes+security%22%7C%22kubernetes+admission+control%22+%22kyverno%22%7C%22opa+gatekeeper%22%7C%22policy+enforcement%22&hl=en&as_sdt=2007&as_ylo=2020&as_yhi=2025"
0,"DSP Chintakayala","Designing and Scaling OPA for PCI-DSS and HIPAA Compliance in AWS",2025,"","norma.ncirl.ie","https://norma.ncirl.ie/8952/","",181,"2026-05-16 00:43:55","","","",,,,,,0,0.00,0,1,1,"… and Open Policy Agent (OPA) for policy enforcement within an AWS CodePipeline-based CI/CD … This research describes in detail how policy enforcement can be made operational with …","https://norma.ncirl.ie/8952/1/dhanushasivapriyachintakayala.pdf","https://scholar.google.com/scholar?q=related:XcYWH0Rnj2kJ:scholar.google.com/&scioq=%22kubernetes+security%22%7C%22kubernetes+admission+control%22+%22kyverno%22%7C%22opa+gatekeeper%22%7C%22policy+enforcement%22&hl=en&as_sdt=2007&as_ylo=2020&as_yhi=2025"
7,"J Her, J Kim, J Kim, S Lee","An in-depth analysis of ebpf-based system security tools in cloud-native environments",2025,"IEEE Access","ieeexplore.ieee.org","https://ieeexplore.ieee.org/abstract/document/11146725/","https://scholar.google.com/scholar?cites=10845890018548461479&as_sdt=2005&sciodt=2007&hl=en",182,"2026-05-16 00:43:55","","","",,,,,,7,7.00,2,4,1,"… In this section, we analyze the policy enforcement layer of ESSTs to understand their key … in the absence of policy enforcement and 0.9193 when policy enforcement was enabled—both …","https://ieeexplore.ieee.org/iel8/6287639/6514899/11146725.pdf","https://scholar.google.com/scholar?q=related:py-JBIJXhJYJ:scholar.google.com/&scioq=%22kubernetes+security%22%7C%22kubernetes+admission+control%22+%22kyverno%22%7C%22opa+gatekeeper%22%7C%22policy+enforcement%22&hl=en&as_sdt=2007&as_ylo=2020&as_yhi=2025"
42,"L Li, K Xiong, G Wang, J Shi","AI-Enhanced Security for Large-Scale Kubernetes Clusters: Advanced Defense and Authentication for National Cloud Infrastructure",2024,"Journal of Theory and Practice of …","academia.edu","https://www.academia.edu/download/119957679/ASEJAR2024030604.pdf","https://scholar.google.com/scholar?cites=7204466397810627520&as_sdt=2005&sciodt=2007&hl=en",183,"2026-05-16 00:43:55","PDF","","",,,,,,42,21.00,11,4,2,"… The integration of AI into Kubernetes security together with the general trend of using … loop, incorporating the outcomes of policy enforcement and any detected security incidents. This …","https://www.academia.edu/download/119957679/ASEJAR2024030604.pdf","https://scholar.google.com/scholar?q=related:wJO9lQRo-2MJ:scholar.google.com/&scioq=%22kubernetes+security%22%7C%22kubernetes+admission+control%22+%22kyverno%22%7C%22opa+gatekeeper%22%7C%22policy+enforcement%22&hl=en&as_sdt=2007&as_ylo=2020&as_yhi=2025"
0,"P Mahajan, L Madaan, A Dhole","Automated and Unified Security Management in Multi-Cloud Architectures",2025,"","","","",184,"2026-05-16 00:43:55","CITATION","","",,,,,,0,0.00,0,3,1,"","","https://scholar.google.com/scholar?q=related:Cdrbj32KufAJ:scholar.google.com/&scioq=%22kubernetes+security%22%7C%22kubernetes+admission+control%22+%22kyverno%22%7C%22opa+gatekeeper%22%7C%22policy+enforcement%22&hl=en&as_sdt=2007&as_ylo=2020&as_yhi=2025"
0,"SJ Golder","In-Depth Analysis of Network Policies in Kubernetes-Based Cloud Infrastructures",,"academia.edu","","https://www.academia.edu/download/124178526/Final_Kubernetes_9_1_.pdf","",185,"2026-05-16 00:43:55","PDF","","",,,,,,0,0.00,0,1,,"… Then, it looks at additional tools like eBPF, which can enhance Kubernetes security. Finally, it … , while also considering general insights into Kubernetes network policy enforcement. …","https://www.academia.edu/download/124178526/Final_Kubernetes_9_1_.pdf","https://scholar.google.com/scholar?q=related:rxDCx_JTHPsJ:scholar.google.com/&scioq=%22kubernetes+security%22%7C%22kubernetes+admission+control%22+%22kyverno%22%7C%22opa+gatekeeper%22%7C%22policy+enforcement%22&hl=en&as_sdt=2007&as_ylo=2020&as_yhi=2025"
50,"Y Yang, W Shen, B Ruan, W Liu…","Security challenges in the container cloud",2021,"2021 Third IEEE …","ieeexplore.ieee.org","https://ieeexplore.ieee.org/abstract/document/9750244/","https://scholar.google.com/scholar?cites=5998061963895150779&as_sdt=2005&sciodt=2007&hl=en",186,"2026-05-16 00:43:55","","","",,,,,,50,10.00,10,5,5,"… 1) Secure Configuration: Many Kubernetes security best practices have been released to … proposed, such as K-Rail, Kyverno and OPA/Gatekeeper. However, it still remains unclear …","https://profile.wohin.me/static/papers/TPS21.pdf","https://scholar.google.com/scholar?q=related:u5jAupNlPVMJ:scholar.google.com/&scioq=%22kubernetes+security%22%7C%22kubernetes+admission+control%22+%22kyverno%22%7C%22opa+gatekeeper%22%7C%22policy+enforcement%22&hl=en&as_sdt=2007&as_ylo=2020&as_yhi=2025"
1,"H Wang","Montag: Cloud Native Data Tainting and Policy Enforcement",2020,"Ph. D. dissertation","eecs.berkeley.edu","https://www2.eecs.berkeley.edu/Pubs/TechRpts/2020/EECS-2020-105.pdf","https://scholar.google.com/scholar?cites=13852587867306138912&as_sdt=2005&sciodt=2007&hl=en",187,"2026-05-16 00:43:55","PDF","","",,,,,,1,0.17,1,1,6,"… Istio works by using a Kubernetes admission control service that automatically injects the necessary Envoy proxy as a sidecar into every pod when the pod is created. We can turn on …","https://www2.eecs.berkeley.edu/Pubs/TechRpts/2020/EECS-2020-105.pdf","https://scholar.google.com/scholar?q=related:IB2rakVHPsAJ:scholar.google.com/&scioq=%22kubernetes+security%22%7C%22kubernetes+admission+control%22+%22kyverno%22%7C%22opa+gatekeeper%22%7C%22policy+enforcement%22&hl=en&as_sdt=2007&as_ylo=2020&as_yhi=2025"
1,"K Kamaluddin","Network isolation for cloud native applications in multitenant Architectures",2023,"","philpapers.org","https://philpapers.org/rec/KAMNIF-2","https://scholar.google.com/scholar?cites=1188612682221274598&as_sdt=2005&sciodt=2007&hl=en",188,"2026-05-16 00:43:55","","","",,,,,,1,0.33,1,1,3,"… that combine continuous monitoring, automated policy enforcement, and adaptive security … (VMware) introducing specialized Kubernetes security posture management. When …","https://philarchive.org/archive/KAMNIF-2","https://scholar.google.com/scholar?q=related:5sVS2-_MfhAJ:scholar.google.com/&scioq=%22kubernetes+security%22%7C%22kubernetes+admission+control%22+%22kyverno%22%7C%22opa+gatekeeper%22%7C%22policy+enforcement%22&hl=en&as_sdt=2007&as_ylo=2020&as_yhi=2025"
