Cites,Authors,Title,Year,Source,Publisher,ArticleURL,CitesURL,GSRank,QueryDate,Type,DOI,ISSN,CitationURL,Volume,Issue,StartPage,EndPage,ECC,CitesPerYear,CitesPerAuthor,AuthorCount,Age,Abstract,FullTextURL,RelatedURL
0,"M Rodriguez, A Sharma, B Foster, O Carter","Comparative Analysis of Tools for Enforcing CIS Kubernetes Node Security Controls at Scale",2023,"","researchgate.net","https://www.researchgate.net/profile/Elena-Rodriguez-85/publication/403258658_Comparative_Analysis_of_Tools_for_Enforcing_CIS_Kubernetes_Node_Security_Controls_at_Scale/links/69c99f0960c0371a60f40f7f/Comparative-Analysis-of-Tools-for-Enforcing-CIS-Kubernetes-Node-Security-Controls-at-Scale.pdf","",83,"2026-05-16 00:43:55","PDF","","",,,,,,0,0.00,0,4,3,"… for security architects and platform engineers seeking to operationalize Kubernetes security. … It can trigger Kubernetes admission controllers (like Kyverno or OPA Gatekeeper) to block …","https://www.researchgate.net/profile/Elena-Rodriguez-85/publication/403258658_Comparative_Analysis_of_Tools_for_Enforcing_CIS_Kubernetes_Node_Security_Controls_at_Scale/links/69c99f0960c0371a60f40f7f/Comparative-Analysis-of-Tools-for-Enforcing-CIS-Kubernetes-Node-Security-Controls-at-Scale.pdf","https://scholar.google.com/scholar?q=related:0StMkpP8z1gJ:scholar.google.com/&scioq=%22kubernetes+security%22%7C%22kubernetes+admission+control%22+%22kyverno%22%7C%22opa+gatekeeper%22%7C%22policy+enforcement%22&hl=en&as_sdt=2007&as_ylo=2020&as_yhi=2025"
12,"J Ray","Policy as Code: Improving Cloud Native Security",2024,"","books.google.com","https://books.google.com/books?hl=en&lr=&id=otwREQAAQBAJ&oi=fnd&pg=PT15&dq=%22kubernetes+security%22%7C%22kubernetes+admission+control%22+%22kyverno%22%7C%22opa+gatekeeper%22%7C%22policy+enforcement%22&ots=HFPWm2cZc4&sig=BrKDowJlQCpKa33FpazhUTvdRXs","https://scholar.google.com/scholar?cites=13525988276968520515&as_sdt=2005&sciodt=2007&hl=en",84,"2026-05-16 00:43:55","BOOK","","",,,,,,12,6.00,12,1,2,"… This book fills a gap I frequently see in many organizations looking to adopt modern software development practices and the cloud—how to think about automated policy enforcement in …","","https://scholar.google.com/scholar?q=related:Q3vOlKz2tbsJ:scholar.google.com/&scioq=%22kubernetes+security%22%7C%22kubernetes+admission+control%22+%22kyverno%22%7C%22opa+gatekeeper%22%7C%22policy+enforcement%22&hl=en&as_sdt=2007&as_ylo=2020&as_yhi=2025"
0,"K Allam","Secure ML Workflows Using Kubernetes: A CKS-Certified Perspective",2023,"International Journal of Emerging Research in …","ijeret.org","https://ijeret.org/index.php/ijeret/article/view/237","",85,"2026-05-16 00:43:55","","","",,,,,,0,0.00,0,1,3,"… Also, we delve into the Kubernetes security layers identifying factors such as Role-Based … For example, Open Policy Agent (OPA) and Kyverno are two security policy enforcement …","https://ijeret.org/index.php/ijeret/article/download/237/225","https://scholar.google.com/scholar?q=related:5B1vxwTFjIsJ:scholar.google.com/&scioq=%22kubernetes+security%22%7C%22kubernetes+admission+control%22+%22kyverno%22%7C%22opa+gatekeeper%22%7C%22policy+enforcement%22&hl=en&as_sdt=2007&as_ylo=2020&as_yhi=2025"
2,"U Kanuru, UK Gurugubelli","Modern Approach to Kubernetes Traffic Management: Migrating from Ingress to GatewayAPI",2025,"International Journal of Emerging Trends in …","ijetcsit.org","https://www.ijetcsit.org/index.php/ijetcsit/article/view/282","https://scholar.google.com/scholar?cites=15461987672971417342&as_sdt=2005&sciodt=2007&hl=en",86,"2026-05-16 00:43:55","","","",,,,,,2,2.00,1,2,1,"This paper presents a comprehensive analysis of the migration from Kubernetes Ingress to the emerging Gateway API for traffic management in cloud-native environments. While …","https://www.ijetcsit.org/index.php/ijetcsit/article/download/282/239","https://scholar.google.com/scholar?q=related:_hbuEN4DlNYJ:scholar.google.com/&scioq=%22kubernetes+security%22%7C%22kubernetes+admission+control%22+%22kyverno%22%7C%22opa+gatekeeper%22%7C%22policy+enforcement%22&hl=en&as_sdt=2007&as_ylo=2020&as_yhi=2025"
0,"E Carlson, L Banerjee, R Nkosi, S Caldwell","Risk-Based Prioritization of CIS Controls for Securing Kubernetes Worker Node Infrastructure",2024,"","researchgate.net","https://www.researchgate.net/profile/Mei-Lin-Zhang/publication/403461291_Risk-Based_Prioritization_of_CIS_Controls_for_Securing_Kubernetes_Worker_Node_Infrastructure/links/69ceef17b6bee423582280fc/Risk-Based-Prioritization-of-CIS-Controls-for-Securing-Kubernetes-Worker-Node-Infrastructure.pdf","",87,"2026-05-16 00:43:55","PDF","","",,,,,,0,0.00,0,4,2,"… Kubernetes security has been extensively studied from architectural and operational perspectives. Tabrizchi and Kuchaki Rafsanjani (2020) provided a comprehensive survey of …","https://www.researchgate.net/profile/Mei-Lin-Zhang/publication/403461291_Risk-Based_Prioritization_of_CIS_Controls_for_Securing_Kubernetes_Worker_Node_Infrastructure/links/69ceef17b6bee423582280fc/Risk-Based-Prioritization-of-CIS-Controls-for-Securing-Kubernetes-Worker-Node-Infrastructure.pdf","https://scholar.google.com/scholar?q=related:y-6OE7efLXcJ:scholar.google.com/&scioq=%22kubernetes+security%22%7C%22kubernetes+admission+control%22+%22kyverno%22%7C%22opa+gatekeeper%22%7C%22policy+enforcement%22&hl=en&as_sdt=2007&as_ylo=2020&as_yhi=2025"
0,"JR Thompson","Real Time Healthcare Analytics Powered by Secure Kubernetes Orchestrated ML Cloud Infrastructure",2025,"International Journal of Computer Technology and …","ijctece.com","https://ijctece.com/index.php/IJCTEC/article/view/445","",88,"2026-05-16 00:43:55","","","",,,,,,0,0.00,0,1,1,"… , encryption at rest and in transit, policy enforcement, and runtime threat detection ensure … Several studies analyze Kubernetes security challenges, including exposed dashboards, …","https://ijctece.com/index.php/IJCTEC/article/download/445/398","https://scholar.google.com/scholar?q=related:3kJMgRjZY90J:scholar.google.com/&scioq=%22kubernetes+security%22%7C%22kubernetes+admission+control%22+%22kyverno%22%7C%22opa+gatekeeper%22%7C%22policy+enforcement%22&hl=en&as_sdt=2007&as_ylo=2020&as_yhi=2025"
0,"BR Cortez, DS Evers","Continuous Security Posture Management for Kubernetes Worker Nodes Aligned with CIS Benchmarks",2023,"","researchgate.net","https://www.researchgate.net/profile/Uthman-Usman-2/publication/403258739_Continuous_Security_Posture_Management_for_Kubernetes_Worker_Nodes_Aligned_with_CIS_Benchmarks/links/69c99c0f9f53d47411c313ff/Continuous-Security-Posture-Management-for-Kubernetes-Worker-Nodes-Aligned-with-CIS-Benchmarks.pdf","",89,"2026-05-16 00:43:55","PDF","","",,,,,,0,0.00,0,2,3,"… Our research sits at the intersection of Kubernetes security, continuous compliance, and policy … Other PaC frameworks like Kyverno are similarly admission-controller focused. …","https://www.researchgate.net/profile/Uthman-Usman-2/publication/403258739_Continuous_Security_Posture_Management_for_Kubernetes_Worker_Nodes_Aligned_with_CIS_Benchmarks/links/69c99c0f9f53d47411c313ff/Continuous-Security-Posture-Management-for-Kubernetes-Worker-Nodes-Aligned-with-CIS-Benchmarks.pdf","https://scholar.google.com/scholar?q=related:eLSi60PiOpMJ:scholar.google.com/&scioq=%22kubernetes+security%22%7C%22kubernetes+admission+control%22+%22kyverno%22%7C%22opa+gatekeeper%22%7C%22policy+enforcement%22&hl=en&as_sdt=2007&as_ylo=2020&as_yhi=2025"
1,"B Muschko","Certified Kubernetes security specialist (CKS) study guide: in-depth guidance and practice",2023,"","books.google.com","https://books.google.com/books?hl=en&lr=&id=RCLEEAAAQBAJ&oi=fnd&pg=PT32&dq=%22kubernetes+security%22%7C%22kubernetes+admission+control%22+%22kyverno%22%7C%22opa+gatekeeper%22%7C%22policy+enforcement%22&ots=ogVZ4T-UZZ&sig=Yn7lJrPnR0ZECtEnPLk8fqxr_ec","https://scholar.google.com/scholar?cites=1402905549425545079&as_sdt=2005&sciodt=2007&hl=en",90,"2026-05-16 00:43:55","BOOK","","",,,,,,1,0.33,1,1,3,"… Identify, mitigate, and/or minimize threats to cloud native applications and Kubernetes clusters Learn the ins and outs of Kubernetes's security features, and external tools for security …","","https://scholar.google.com/scholar?q=related:dw_vDiofeBMJ:scholar.google.com/&scioq=%22kubernetes+security%22%7C%22kubernetes+admission+control%22+%22kyverno%22%7C%22opa+gatekeeper%22%7C%22policy+enforcement%22&hl=en&as_sdt=2007&as_ylo=2020&as_yhi=2025"
0,"T Sagaram, P Swetha…","Multi-Layered Runtime Defense Against Cryptocurrency Mining in Kubernetes Using Falco, Kyverno, and Behavior Analytics",2025,"2025 66th International …","ieeexplore.ieee.org","https://ieeexplore.ieee.org/abstract/document/11236625/","",91,"2026-05-16 00:43:55","","","",,,,,,0,0.00,0,3,1,"… Kyverno Cleanup Policy and RBAC Setup To enable Kyverno to automatically delete pods … policy and configure RBAC permissions for the Kyverno cleanup controller. This allows it to …","","https://scholar.google.com/scholar?q=related:83ya-qgMzpMJ:scholar.google.com/&scioq=%22kubernetes+security%22%7C%22kubernetes+admission+control%22+%22kyverno%22%7C%22opa+gatekeeper%22%7C%22policy+enforcement%22&hl=en&as_sdt=2007&as_ylo=2020&as_yhi=2025"
5,"C Cesarano, R Natella","Kubefence: Security hardening of the kubernetes attack surface",2025,"2025 55th Annual IEEE/IFIP …","ieeexplore.ieee.org","https://ieeexplore.ieee.org/abstract/document/11068711/","https://scholar.google.com/scholar?cites=15689168287304475237&as_sdt=2005&sciodt=2007&hl=en",92,"2026-05-16 00:43:55","","","",,,,,,5,5.00,3,2,1,"… This paper introduced KubeFence, a proxy-based enforcement mechanism that enhances Kubernetes security by automatically generating and enforcing fine-grained API security …","https://arxiv.org/pdf/2504.11126","https://scholar.google.com/scholar?q=related:ZWIbum4fu9kJ:scholar.google.com/&scioq=%22kubernetes+security%22%7C%22kubernetes+admission+control%22+%22kyverno%22%7C%22opa+gatekeeper%22%7C%22policy+enforcement%22&hl=en&as_sdt=2007&as_ylo=2020&as_yhi=2025"
0,"R Medeiros, L Sampaio, R Agra…","Using LSMs to Strengthen Access Control of Applications that use hostPath in Kubernetes Clusters",2025,"Simpósio Brasileiro de …","sol.sbc.org.br","https://sol.sbc.org.br/index.php/sbseg/article/view/36667","",93,"2026-05-16 00:43:55","","","",,,,,,0,0.00,0,4,1,"This paper presents a methodology to enhance the security of Kubernetes clusters using hostPath volumes, a feature that introduces considerable risks due to direct host access. Our …","https://sol.sbc.org.br/index.php/sbseg/article/download/36667/36454","https://scholar.google.com/scholar?q=related:JU6onrm-ix0J:scholar.google.com/&scioq=%22kubernetes+security%22%7C%22kubernetes+admission+control%22+%22kyverno%22%7C%22opa+gatekeeper%22%7C%22policy+enforcement%22&hl=en&as_sdt=2007&as_ylo=2020&as_yhi=2025"
8,"D Muresu","Investigating the security of a microservices architecture: A case study on microservice and Kubernetes Security",2021,"","diva-portal.org","https://www.diva-portal.org/smash/record.jsf?pid=diva2:1597972","https://scholar.google.com/scholar?cites=2168458237442018076&as_sdt=2005&sciodt=2007&hl=en",94,"2026-05-16 00:43:55","","","",,,,,,8,1.60,8,1,5,"… This first round will illuminate Kubernetes security and be conducted in order to firstly help … In this section, papers on microservices security, container security and Kubernetes security …","https://www.diva-portal.org/smash/get/diva2:1597972/FULLTEXT01.pdf","https://scholar.google.com/scholar?q=related:HEsAKUfpFx4J:scholar.google.com/&scioq=%22kubernetes+security%22%7C%22kubernetes+admission+control%22+%22kyverno%22%7C%22opa+gatekeeper%22%7C%22policy+enforcement%22&hl=en&as_sdt=2007&as_ylo=2020&as_yhi=2025"
0,"R Stevenson, N Wright, A Foster","Infrastructure-as-Code Strategies for Embedding CIS Security Controls in Kubernetes Clusters",2023,"","researchgate.net","https://www.researchgate.net/profile/Richard-Wilding-5/publication/404196794_Infrastructure-as-Code_Strategies_for_Embedding_CIS_Security_Controls_in_Kubernetes_Clusters/links/69ed0d76751e8801513da550/Infrastructure-as-Code-Strategies-for-Embedding-CIS-Security-Controls-in-Kubernetes-Clusters.pdf","",95,"2026-05-16 00:43:55","PDF","","",,,,,,0,0.00,0,3,3,"… GitOps-based compliance verification using Flux and Kyverno. We validate CIEF on a production… This paper presented CIEF, a framework that embeds CIS Kubernetes security controls …","https://www.researchgate.net/profile/Richard-Wilding-5/publication/404196794_Infrastructure-as-Code_Strategies_for_Embedding_CIS_Security_Controls_in_Kubernetes_Clusters/links/69ed0d76751e8801513da550/Infrastructure-as-Code-Strategies-for-Embedding-CIS-Security-Controls-in-Kubernetes-Clusters.pdf","https://scholar.google.com/scholar?q=related:x5ekYik02soJ:scholar.google.com/&scioq=%22kubernetes+security%22%7C%22kubernetes+admission+control%22+%22kyverno%22%7C%22opa+gatekeeper%22%7C%22policy+enforcement%22&hl=en&as_sdt=2007&as_ylo=2020&as_yhi=2025"
0,"M Usha","Next Generation Real Time Healthcare Analytics via Secure Kubernetes Enabled ML Cloud",2025,"International Journal of Science, Research and …","ijsrat.com","http://www.ijsrat.com/index.php/ijsrat/article/view/59","",96,"2026-05-16 00:43:55","","","",,,,,,0,0.00,0,1,1,"… , compliance validation, and policy enforcement into CI/CD … consistent policy enforcement across these environments. … policy enforcement and better isolation between workloads. …","http://www.ijsrat.com/index.php/ijsrat/article/download/59/54","https://scholar.google.com/scholar?q=related:7Fgl2YNnkI4J:scholar.google.com/&scioq=%22kubernetes+security%22%7C%22kubernetes+admission+control%22+%22kyverno%22%7C%22opa+gatekeeper%22%7C%22policy+enforcement%22&hl=en&as_sdt=2007&as_ylo=2020&as_yhi=2025"
0,"P Madduri","ZERO-TRUST INFRASTRUCTURE: AUTOMATED IDENTITY GOVERNANCE IN KUBERNETES-A FRAMEWORK FOR ZERO-TRUST MICROSERVICES",2023,"Power System Protection and Control","pspac.info","http://pspac.info/index.php/dlbh/article/view/218","",97,"2026-05-16 00:43:55","","","",,,,,,0,0.00,0,1,3,"… Classic Kubernetes security relies heavily on network … The complexity of distributed policy enforcement risks … substantially improve their Kubernetes security posture while …","https://pspac.info/index.php/dlbh/article/download/218/172","https://scholar.google.com/scholar?q=related:0jjrAZEvyRwJ:scholar.google.com/&scioq=%22kubernetes+security%22%7C%22kubernetes+admission+control%22+%22kyverno%22%7C%22opa+gatekeeper%22%7C%22policy+enforcement%22&hl=en&as_sdt=2007&as_ylo=2020&as_yhi=2025"
0,"B Noble, L Stein, N Vasquez, T Aldridge","Measuring the Effectiveness of CIS Control Enforcement in Kubernetes Worker Node Security Posture",2023,"","researchgate.net","https://www.researchgate.net/profile/Bruce-William-2/publication/404197755_Measuring_the_Effectiveness_of_CIS_Control_Enforcement_in_Kubernetes_Worker_Node_Security_Posture/links/69ed0dda32a2ba2b2d558290/Measuring-the-Effectiveness-of-CIS-Control-Enforcement-in-Kubernetes-Worker-Node-Security-Posture.pdf","",98,"2026-05-16 00:43:55","PDF","","",,,,,,0,0.00,0,4,3,"Kubernetes has become the de facto orchestration platform for containerized workloads, yet worker node security remains a persistent challenge despite Center for Internet Security (CIS…","https://www.researchgate.net/profile/Bruce-William-2/publication/404197755_Measuring_the_Effectiveness_of_CIS_Control_Enforcement_in_Kubernetes_Worker_Node_Security_Posture/links/69ed0dda32a2ba2b2d558290/Measuring-the-Effectiveness-of-CIS-Control-Enforcement-in-Kubernetes-Worker-Node-Security-Posture.pdf","https://scholar.google.com/scholar?q=related:XwsqG8YUsYwJ:scholar.google.com/&scioq=%22kubernetes+security%22%7C%22kubernetes+admission+control%22+%22kyverno%22%7C%22opa+gatekeeper%22%7C%22policy+enforcement%22&hl=en&as_sdt=2007&as_ylo=2020&as_yhi=2025"
0,"V Gjersøe, MAW Asbjørnsen, SH Houmb…","Secure and Resource Effective Usage of Containers for Military and Critical Infrastructure Environments",2025,"Norsk IKT-konferanse for …","ntnu.no","https://www.ntnu.no/ojs/index.php/nikt/article/view/6512","",99,"2026-05-16 00:43:55","","","",,,,,,0,0.00,0,4,1,"… The goal was to investigate how Kubernetes security mechanisms affect performance in … In this way it would be possible to pair continuous training with policy enforcement and …","https://www.ntnu.no/ojs/index.php/nikt/article/download/6512/5843","https://scholar.google.com/scholar?q=related:d0zkQrTMvkgJ:scholar.google.com/&scioq=%22kubernetes+security%22%7C%22kubernetes+admission+control%22+%22kyverno%22%7C%22opa+gatekeeper%22%7C%22policy+enforcement%22&hl=en&as_sdt=2007&as_ylo=2020&as_yhi=2025"
5,"G Budigiri, C Baumann, E Truyen…","Zero-cost in-depth enforcement of network policies for low-latency cloud-native systems",2023,"2023 IEEE 16th …","ieeexplore.ieee.org","https://ieeexplore.ieee.org/abstract/document/10254996/","https://scholar.google.com/scholar?cites=9768484681947428612&as_sdt=2005&sciodt=2007&hl=en",100,"2026-05-16 00:43:55","","","",,,,,,5,1.67,1,4,3,"… for policy enforcement, and in this paper Calico and Cilium CNI plugins were used because they support extended Berkeley Packet Filter (eBPF) technology for fast policy enforcement, …","https://lirias.kuleuven.be/retrieve/745851","https://scholar.google.com/scholar?q=related:BDdSBRChkIcJ:scholar.google.com/&scioq=%22kubernetes+security%22%7C%22kubernetes+admission+control%22+%22kyverno%22%7C%22opa+gatekeeper%22%7C%22policy+enforcement%22&hl=en&as_sdt=2007&as_ylo=2020&as_yhi=2025"
2,"M Rangta","Tools for security auditing and hardening in microservices architecture",2022,"","aaltodoc.aalto.fi","https://aaltodoc.aalto.fi/items/0ec6d96b-9bd9-4fd5-b573-70bf893a408b","https://scholar.google.com/scholar?cites=14859355611209614392&as_sdt=2005&sciodt=2007&hl=en",101,"2026-05-16 00:43:55","","","",,,,,,2,0.50,2,1,4,"… Figure 2.9 based on [16] illustrates the network policy enforcement at a pod using its … Like other Kubernetes security analysis tools described in Chapter 3, the Kube Patrol tool is …","https://aaltodoc.aalto.fi/bitstreams/389746f0-73ab-40b5-be56-40fb7c0c2e5f/download","https://scholar.google.com/scholar?q=related:OERbPTMJN84J:scholar.google.com/&scioq=%22kubernetes+security%22%7C%22kubernetes+admission+control%22+%22kyverno%22%7C%22opa+gatekeeper%22%7C%22policy+enforcement%22&hl=en&as_sdt=2007&as_ylo=2020&as_yhi=2025"
7,"P Mytilinakis","Attack methods and defenses on Kubernetes",2020,"","dione.lib.unipi.gr","https://dione.lib.unipi.gr/xmlui/handle/unipi/12888","https://scholar.google.com/scholar?cites=2971656265025927508&as_sdt=2005&sciodt=2007&hl=en",102,"2026-05-16 00:43:55","","","",,,,,,7,1.17,7,1,6,"… While Kubernetes security includes the scope of all Kubernetes components, it is important … However, only with this policy enforcement, Docker allows the processes in one container to …","https://dione.lib.unipi.gr/xmlui/bitstream/handle/unipi/12888/Mytilinakis_mte1822.pdf?sequence=1","https://scholar.google.com/scholar?q=related:VDlv56BxPSkJ:scholar.google.com/&scioq=%22kubernetes+security%22%7C%22kubernetes+admission+control%22+%22kyverno%22%7C%22opa+gatekeeper%22%7C%22policy+enforcement%22&hl=en&as_sdt=2007&as_ylo=2020&as_yhi=2025"
5,"G Budigiri","Secure and scalable policy management in cloud native networking",2023,"Proceedings of the 24th International Middleware …","dl.acm.org","https://dl.acm.org/doi/abs/10.1145/3626564.3629092","https://scholar.google.com/scholar?cites=6880382649965531740&as_sdt=2005&sciodt=2007&hl=en",103,"2026-05-16 00:43:55","","10.1145/3626564.3629092","",,,,,,5,1.67,5,1,3,"Support for Ultra-Reliable Low-Latency Communication (URLLC) in 5G networks has made the adoption of edge computing and cloud-native computing imperative. However, URLLC …","https://dl.acm.org/doi/pdf/10.1145/3626564.3629092","https://scholar.google.com/scholar?q=related:XNL0-ZAHfF8J:scholar.google.com/&scioq=%22kubernetes+security%22%7C%22kubernetes+admission+control%22+%22kyverno%22%7C%22opa+gatekeeper%22%7C%22policy+enforcement%22&hl=en&as_sdt=2007&as_ylo=2020&as_yhi=2025"
15,"A Martin, M Hausenblas","Hacking Kubernetes",2021,"","books.google.com","https://books.google.com/books?hl=en&lr=&id=tg9IEAAAQBAJ&oi=fnd&pg=PP1&dq=%22kubernetes+security%22%7C%22kubernetes+admission+control%22+%22kyverno%22%7C%22opa+gatekeeper%22%7C%22policy+enforcement%22&ots=l64FndOLyK&sig=LAkm88Bd0TA_MmPFzS2KJVlf5iA","https://scholar.google.com/scholar?cites=5915860965243927455&as_sdt=2005&sciodt=2007&hl=en",104,"2026-05-16 00:43:55","BOOK","","",,,,,,15,3.00,8,2,5,"… This practical book provides a threat-based guide to Kubernetes security. Each chapter … policy with RBAC, OPA, and Kyverno Dive deep into sandboxing and isolation techniques Learn …","","https://scholar.google.com/scholar?q=related:n7v2TTRcGVIJ:scholar.google.com/&scioq=%22kubernetes+security%22%7C%22kubernetes+admission+control%22+%22kyverno%22%7C%22opa+gatekeeper%22%7C%22policy+enforcement%22&hl=en&as_sdt=2007&as_ylo=2020&as_yhi=2025"
7,"M Caracciolo","Policy as Code, how to automate cloud compliance verification with open-source tools",2023,"","webthesis.biblio.polito.it","https://webthesis.biblio.polito.it/26908/?template=default","https://scholar.google.com/scholar?cites=7294091394272316881&as_sdt=2005&sciodt=2007&hl=en",105,"2026-05-16 00:43:55","","","",,,,,,7,2.33,7,1,3,"… , Google Cloud, and Kubernetes security and compliance violations before deployment. … Policy enforcement can be triggered in different ways which are defined by using the mode …","https://webthesis.biblio.polito.it/26908/1/tesi.pdf","https://scholar.google.com/scholar?q=related:0c3VMnrROWUJ:scholar.google.com/&scioq=%22kubernetes+security%22%7C%22kubernetes+admission+control%22+%22kyverno%22%7C%22opa+gatekeeper%22%7C%22policy+enforcement%22&hl=en&as_sdt=2007&as_ylo=2020&as_yhi=2025"
13,"M Femminella, M Palmucci, G Reali…","Attribute-based management of secure Kubernetes cloud bursting",2024,"IEEE Open Journal of …","ieeexplore.ieee.org","https://ieeexplore.ieee.org/abstract/document/10440131/","https://scholar.google.com/scholar?cites=11218230145462991221&as_sdt=2005&sciodt=2007&hl=en",106,"2026-05-16 00:43:55","","","",,,,,,13,6.50,3,4,2,"In modern cloud computing, the need for flexible and scalable orchestration of services, combined with robust security measures, is paramount. In this paper, we propose an innovative …","https://ieeexplore.ieee.org/iel7/8782661/8901158/10440131.pdf","https://scholar.google.com/scholar?q=related:dXnmbOEor5sJ:scholar.google.com/&scioq=%22kubernetes+security%22%7C%22kubernetes+admission+control%22+%22kyverno%22%7C%22opa+gatekeeper%22%7C%22policy+enforcement%22&hl=en&as_sdt=2007&as_ylo=2020&as_yhi=2025"
0,"S Gerling, K Jeffrey, G Jacob, B Brandon, E Brandon","Policy-as-Code Frameworks for Continuous Hardening and Security Validation of Linux Systems",2025,"","researchgate.net","https://www.researchgate.net/profile/Arina-Finnegan-2/publication/399515491_Policy-as-Code_Frameworks_for_Continuous_Hardening_and_Security_Validation_of_Linux_Systems/links/695d8e7a06a9ab54f84f618b/Policy-as-Code-Frameworks-for-Continuous-Hardening-and-Security-Validation-of-Linux-Systems.pdf","",107,"2026-05-16 00:43:55","PDF","","",,,,,,0,0.00,0,5,1,"… Its primary design is for cloud-native contexts like Kubernetes admission control, API authorization, and IaC validation. Applying OPA to OS-level hardening requires representing the …","https://www.researchgate.net/profile/Arina-Finnegan-2/publication/399515491_Policy-as-Code_Frameworks_for_Continuous_Hardening_and_Security_Validation_of_Linux_Systems/links/695d8e7a06a9ab54f84f618b/Policy-as-Code-Frameworks-for-Continuous-Hardening-and-Security-Validation-of-Linux-Systems.pdf","https://scholar.google.com/scholar?q=related:p8CeA-iUuR0J:scholar.google.com/&scioq=%22kubernetes+security%22%7C%22kubernetes+admission+control%22+%22kyverno%22%7C%22opa+gatekeeper%22%7C%22policy+enforcement%22&hl=en&as_sdt=2007&as_ylo=2020&as_yhi=2025"
0,"C Dumont, E Walker, G Hartnell","Integrating DevSecOps Pipelines with CIS Benchmark Validation for Kubernetes Worker Node Hardening",2024,"","researchgate.net","https://www.researchgate.net/profile/Lanre-Akintayo/publication/403461716_Integrating_DevSecOps_Pipelines_with_CIS_Benchmark_Validation_for_Kubernetes_Worker_Node_Hardening/links/69ceec929f53d47411c42f38/Integrating-DevSecOps-Pipelines-with-CIS-Benchmark-Validation-for-Kubernetes-Worker-Node-Hardening.pdf","",108,"2026-05-16 00:43:55","PDF","","",,,,,,0,0.00,0,3,2,"… seeking to operationalize Kubernetes security at scale within a DevSecOps culture. … Section 2 reviews related work in Kubernetes security and compliance automation. Section 3 details …","https://www.researchgate.net/profile/Lanre-Akintayo/publication/403461716_Integrating_DevSecOps_Pipelines_with_CIS_Benchmark_Validation_for_Kubernetes_Worker_Node_Hardening/links/69ceec929f53d47411c42f38/Integrating-DevSecOps-Pipelines-with-CIS-Benchmark-Validation-for-Kubernetes-Worker-Node-Hardening.pdf","https://scholar.google.com/scholar?q=related:-lD1MMst2tIJ:scholar.google.com/&scioq=%22kubernetes+security%22%7C%22kubernetes+admission+control%22+%22kyverno%22%7C%22opa+gatekeeper%22%7C%22policy+enforcement%22&hl=en&as_sdt=2007&as_ylo=2020&as_yhi=2025"
